"location","source","target","id","fuzzy","context","translator_comments","developer_comments"
"Scripts/Content/Story/Dialoge/City/Harbour/DIA_VLK_Lehmar.d:161","Как мы и договаривались, я спишу твои проценты. Ты снова должен мне только 100 золотых.","Jak uzgodniliśmy, umorzę ci odsetki. Znowu dług wynosi 100 sztuk złota.","","False","dia_lehmar_rupert_givesword_09_02","",""
"Scripts/Content/Story/Dialoge/City/Harbour/DIA_VLK_Lehmar.d:162","И лучше, если ты вернешь их вовремя. Бизнес есть бизнес.","I najlepiej, jeśli zwrócisz go na czas. Interes to interes.","","False","dia_lehmar_rupert_givesword_09_03","",""
"Scripts/Content/Story/Dialoge/City/Harbour/DIA_VLK_Lehmar.d:167","Слышал, тебе такой нужен.","Podobno potrzebujesz taki miecz.","","False","dia_lehmar_rupert_givesword_03_04","",""
"Scripts/Content/Story/Dialoge/City/Harbour/DIA_VLK_Lehmar.d:168","Что? Откуда ты?.. А, не важно.","Co? Skąd wiesz? Ach, to nieważne.","","False","dia_lehmar_rupert_givesword_09_05","",""
"Scripts/Content/Story/Dialoge/City/Harbour/DIA_VLK_Lehmar.d:169","Я действительно давно ищу такой меч. ","Od dawna poszukiwałem takiego miecza.","","False","dia_lehmar_rupert_givesword_09_06","",""
"Scripts/Content/Story/Dialoge/City/Harbour/DIA_VLK_Lehmar.d:170","Сгодится в качестве уплаты долга?","Czy ujmiesz to jako spłatę długu?","","False","dia_lehmar_rupert_givesword_03_07","",""
"Scripts/Content/Story/Dialoge/City/Harbour/DIA_VLK_Lehmar.d:171","Да, задери меня орк! Давай его сюда, и катись, пока я не передумал!","A niech to diabli! Daj mi go i wynoś się stąd, zanim zmienię zdanie!","","False","dia_lehmar_rupert_givesword_09_08","",""
"Scripts/Content/Story/Dialoge/City/Harbour/DIA_VLK_Lehmar.d:199","Ты! Посмел заявиться сам!","Ty! Masz odwagę tu przyjść!","","False","dia_lehmar_rupert_punishment_09_00","",""
"Scripts/Content/Story/Dialoge/City/Harbour/DIA_VLK_Lehmar.d:200","Я хотел...","Chcę...","","False","dia_lehmar_rupert_punishment_03_01","",""
"Scripts/Content/Story/Dialoge/City/Harbour/DIA_VLK_Lehmar.d:201","Мне плевать, что ты там хотел! Я ждал более, чем достаточно.","Nie obchodzi mnie, czego chcesz! Czekałem zbyt długo.","","False","dia_lehmar_rupert_punishment_09_02","",""
"Scripts/Content/Story/Dialoge/City/Harbour/DIA_VLK_Lehmar.d:228","Пошел вон!","Wynoś się!","","False","dia_lehmar_rupert_getout_09_00","",""
"Scripts/Content/Story/Dialoge/City/Harbour/DIA_VLK_Lehmar.d:242","Я слыхала, у тебя есть кубок Верности.","Podobno masz Puchar Wierności.","","False","dia_lehmar_elena_aboutcup.description","",""
"Scripts/Content/Story/Dialoge/City/Harbour/DIA_VLK_Lehmar.d:254","Здравствуй. Я слыхала, у тебя есть кубок Верности.","Witaj. Podobno masz Puchar Wierności.","","False","dia_lehmar_elena_aboutcup_16_00","",""
"Scripts/Content/Story/Dialoge/City/Harbour/DIA_VLK_Lehmar.d:255","И что?","No i co?","","False","dia_lehmar_elena_aboutcup_09_01","",""
"Scripts/Content/Story/Dialoge/City/Harbour/DIA_VLK_Lehmar.d:256","Я бы хотела его выкупить.","Chcę go odkupić.","","False","dia_lehmar_elena_aboutcup_16_02","",""
"Scripts/Content/Story/Dialoge/City/Harbour/DIA_VLK_Lehmar.d:257","Нет.","Nic z tego.","","False","dia_lehmar_elena_aboutcup_09_03","",""
"Scripts/Content/Story/Dialoge/City/Harbour/DIA_VLK_Lehmar.d:258","Но почему?","A to dlaczego?","","False","dia_lehmar_elena_aboutcup_16_04","",""
"Scripts/Content/Story/Dialoge/City/Harbour/DIA_VLK_Lehmar.d:259","Я не обязан перед тобой объясняться!","Nie muszę tobie się tłumaczyć!","","False","dia_lehmar_elena_aboutcup_09_05","",""
"Scripts/Content/Story/Dialoge/City/Harbour/DIA_VLK_Lehmar.d:260","Это мой кубок - хочу продаю, хочу не продаю!","To mój puchar! Jak zechcę, to go sprzedam, a jeśli nie, to go nie sprzedam!","","False","dia_lehmar_elena_aboutcup_09_06","",""
"Scripts/Content/Story/Dialoge/City/Harbour/DIA_VLK_Lehmar.d:271","Я заплачу, сколько захочешь.","Zapłacę, ile będziesz chciał.","","False","dia_lehmar_elena_aboutcupperm.description","",""
"Scripts/Content/Story/Dialoge/City/Harbour/DIA_VLK_Lehmar.d:284","Я заплачу, сколько захочешь.","Zapłacę, ile będziesz chciał.","","False","dia_lehmar_elena_aboutcupperm_16_00","",""
"Scripts/Content/Story/Dialoge/City/Harbour/DIA_VLK_Lehmar.d:285","Нет. Он не продается.","Nic z tego. Puchar nie jest na sprzedaż.","","False","dia_lehmar_elena_aboutcupperm_09_01","",""
"Scripts/Content/Story/Dialoge/City/Harbour/DIA_VLK_Lehmar.d:307","Эй ты, девка! Да, я тебе!","Ej, ty! Ja ci pokażę!","","False","dia_lehmar_elena_cuplost_09_00","",""
"Scripts/Content/Story/Dialoge/City/Harbour/DIA_VLK_Lehmar.d:308","У меня пропал кубок Верности, после того, как ты о нем распрашивала.","Podczas naszej rozmowy, zniknął mi Puchar Wierności.","","False","dia_lehmar_elena_cuplost_09_01","",""
"Scripts/Content/Story/Dialoge/City/Harbour/DIA_VLK_Lehmar.d:309","Думаешь, я тупой? Верни мне кубок, воровка!","Myślisz, że jestem taki głupi? Natychmiast oddaj mi puchar!","","False","dia_lehmar_elena_cuplost_09_02","",""
"Scripts/Content/Story/Dialoge/City/Harbour/DIA_VLK_Lehmar.d:311","(с искренним удивлением) Так его у тебя украли? Я просто выкупила его...","Więc został ci skradziony? Właśnie udało mi się go odkupić...","","False","dia_lehmar_elena_cuplost.dia_lehmar_elena_cuplost_bought","Info_AddChoice",""
"Scripts/Content/Story/Dialoge/City/Harbour/DIA_VLK_Lehmar.d:312","(сухо) У меня его нет.","Nie mam go.","","False","dia_lehmar_elena_cuplost.dia_lehmar_elena_cuplost_no","Info_AddChoice",""
"Scripts/Content/Story/Dialoge/City/Harbour/DIA_VLK_Lehmar.d:318","(сухо) У меня его нет.","Nie mam go.","","False","dia_lehmar_elena_cuplost_no_17_00","",""
"Scripts/Content/Story/Dialoge/City/Harbour/DIA_VLK_Lehmar.d:319","(с угрозой) А если я тебя обыщу?","A jeśli cię obszukam?","","False","dia_lehmar_elena_cuplost_no_09_01","",""
"Scripts/Content/Story/Dialoge/City/Harbour/DIA_VLK_Lehmar.d:320","Ну, попробуй.","No cóż, próbuj.","","False","dia_lehmar_elena_cuplost_no_17_02","",""
"Scripts/Content/Story/Dialoge/City/Harbour/DIA_VLK_Lehmar.d:328","(искренне) Так его у тебя украли? Я просто выкупила его...","Więc został ci skradziony? Właśnie udało mi się go odkupić...","","False","dia_lehmar_elena_cuplost_bought_17_00","",""
"Scripts/Content/Story/Dialoge/City/Harbour/DIA_VLK_Lehmar.d:329","(задыхаясь) И у тебя хватает наглости...","Nie brakuje ci tupetu...","","False","dia_lehmar_elena_cuplost_bought_09_01","",""
"Scripts/Content/Story/Dialoge/City/Harbour/DIA_VLK_Lehmar.d:330","Верни кубок сейчас же!","Natychmiast oddawaj puchar!","","False","dia_lehmar_elena_cuplost_bought_09_02","",""
"Scripts/Content/Story/Dialoge/City/Harbour/DIA_VLK_Lehmar.d:332","Я за него честно заплатила! Ничего не знаю.","Zdobycie go kosztowało mnie sporo złota! Nic nie wiem o kradzieży.","","False","dia_lehmar_elena_cuplost.dia_lehmar_elena_cuplost_mycup","Info_AddChoice",""
"Scripts/Content/Story/Dialoge/City/Harbour/DIA_VLK_Lehmar.d:334","Вот, возьми. Я правда не знала, прости.","Masz, weź go. Naprawdę nie było mi wiadomo, że był skradziony.","","False","dia_lehmar_elena_cuplost.dia_lehmar_elena_cuplost_return","Info_AddChoice",""
"Scripts/Content/Story/Dialoge/City/Harbour/DIA_VLK_Lehmar.d:337","У меня нет его с собой. Подожди, я принесу.","Nie mam pucharu przy sobie. Poczekaj zaraz go przyniosę.","","False","dia_lehmar_elena_cuplost.dia_lehmar_elena_cuplost_nocup","Info_AddChoice",""
"Scripts/Content/Story/Dialoge/City/Harbour/DIA_VLK_Lehmar.d:342","Вот, возьми. Я правда не знала, прости.","Masz, weź go. Naprawdę nie było mi wiadomo, że był skradziony.","","False","dia_lehmar_elena_cuplost_return_17_00","",""
"Scripts/Content/Story/Dialoge/City/Harbour/DIA_VLK_Lehmar.d:344","Ладно, я тебе верю.","Dobra, wierzę ci.","","False","dia_lehmar_elena_cuplost_return_09_01","",""
"Scripts/Content/Story/Dialoge/City/Harbour/DIA_VLK_Lehmar.d:356","Чем тебе так дорог этот кубок?","Dlaczego tak ci zależy na tym pucharze?","","False","dia_lehmar_elena_cuplost.dia_lehmar_elena_whytreasure_info","Info_AddChoice",""
"Scripts/Content/Story/Dialoge/City/Harbour/DIA_VLK_Lehmar.d:360","Чем тебе так дорог этот кубок?","Dlaczego tak ci zależy na tym pucharze?","","False","dia_lehmar_elena_whytreasure_17_00","",""
"Scripts/Content/Story/Dialoge/City/Harbour/DIA_VLK_Lehmar.d:361","До чего же ты любопытная... Прямо как моя дочурка.","A co się tym tak interesujesz? Zupełnie jak moja córcia.","","False","dia_lehmar_elena_whytreasure_09_01","",""
"Scripts/Content/Story/Dialoge/City/Harbour/DIA_VLK_Lehmar.d:362","Ей на свадьбу я эти кубки готовил, такого жениха подобрал, а она сбежала с каким-то проходимцем на материк!","Przygotowałem te puchary na jej ślub, wybrałem dla niej odpowiedniego pana młodego, a ona uciekła na kontynent z jakimś łajdakiem!","","False","dia_lehmar_elena_whytreasure_09_02","",""
"Scripts/Content/Story/Dialoge/City/Harbour/DIA_VLK_Lehmar.d:363","Семь лет о ней ни слуху, ни духу. Может, и сгинула уже.","Od siedmiu lat nie mam o niej żadnych wieści. Może nawet już nie żyje.","","False","dia_lehmar_elena_whytreasure_09_03","",""
"Scripts/Content/Story/Dialoge/City/Harbour/DIA_VLK_Lehmar.d:369","У меня нет его с собой. Подожди, я принесу.","Nie mam pucharu przy sobie. Poczekaj zaraz go przyniosę.","","False","dia_lehmar_elena_cuplost_nocup_17_00","",""
"Scripts/Content/Story/Dialoge/City/Harbour/DIA_VLK_Lehmar.d:370","С какой стати я должен тебе верить?","Dlaczego miałbym ci wierzyć?","","False","dia_lehmar_elena_cuplost_nocup_09_01","",""
"Scripts/Content/Story/Dialoge/City/Harbour/DIA_VLK_Lehmar.d:371","Можешь обыскать меня, но это тебе ничего не даст.","Możesz mnie obszukać, ale tak nic nie znajdziesz.","","False","dia_lehmar_elena_cuplost_nocup_17_02","",""
"Scripts/Content/Story/Dialoge/City/Harbour/DIA_VLK_Lehmar.d:372","Ну и катись отсюда, стерва! И чтобы я тебя больше не видел.","Wynoś się stąd! I nie chcę cię więcej widzieć.","","False","dia_lehmar_elena_cuplost_nocup_09_03","",""
"Scripts/Content/Story/Dialoge/City/Harbour/DIA_VLK_Lehmar.d:380","Я за него честно заплатила! Ничего не знаю.","Zdobycie go kosztowało mnie sporo złota! Nic nie wiem o kradzieży.","","False","dia_lehmar_elena_cuplost_mycup_17_00","",""
"Scripts/Content/Story/Dialoge/City/Harbour/DIA_VLK_Lehmar.d:381","Ах ты, сучка! Только попробуй еще показаться тут!","Ach ty gnido! Więcej tu się nie pokazuj!","","False","dia_lehmar_elena_cuplost_mycup_09_01","",""
"Scripts/Content/Story/Dialoge/City/Harbour/DIA_VLK_Lehmar.d:404","Ты принесла кубок?","Masz puchar?","","False","dia_lehmar_elena_returncup_09_00","",""
"Scripts/Content/Story/Dialoge/City/Harbour/DIA_VLK_Lehmar.d:406","Да, вот он.","Tak, oto on.","","False","dia_lehmar_elena_returncup_17_01","",""
"Scripts/Content/Story/Dialoge/City/Harbour/DIA_VLK_Lehmar.d:410","Еще нет...","Jeszcze nie...","","False","dia_lehmar_elena_returncup_17_02","",""
"Scripts/Content/Story/Dialoge/City/Harbour/DIA_VLK_Lehmar.d:411","Тогда вали отсюда!","Więc wynocha stąd!","","False","dia_lehmar_elena_returncup_09_03","",""
"Scripts/Content/Story/Dialoge/City/Harbour/DIA_VLK_Lehmar.d:423","Еще раз прости за кубок.","Jeszcze raz przepraszam za sytuację z pucharem.","","False","dia_lehmar_elena_afterreturnperm.description","",""
"Scripts/Content/Story/Dialoge/City/Harbour/DIA_VLK_Lehmar.d:435","Еще раз прости за кубок.","Jeszcze raz przepraszam za sytuację z pucharem.","","False","dia_lehmar_elena_afterreturnperm_17_00","",""
"Scripts/Content/Story/Dialoge/City/Harbour/DIA_VLK_Lehmar.d:437","Извинения приняты. Но я его тебе все равно не продам.","Przyjmuję przeprosiny. Ale nadal nie jest na sprzedaż.","","False","dia_lehmar_elena_afterreturnperm_09_01","",""
"Scripts/Content/Story/Dialoge/City/Harbour/DIA_VLK_Lehmar.d:441","Просто оставь меня в покое.","Zostaw mnie w spokoju.","","False","dia_lehmar_elena_afterreturnperm_09_02","",""
"Scripts/Content/Story/Dialoge/City/Harbour/DIA_VLK_Lehmar.d:451","Тебе нужен второй Кубок верности?","Potrzebujesz drugi Puchar Wierności?","","False","dia_lehmar_elena_returnothercup.description","",""
"Scripts/Content/Story/Dialoge/City/Harbour/DIA_VLK_Lehmar.d:463","Тебе нужен второй кубок Верности?","Potrzebujesz drugi Puchar Wierności?","","False","dia_lehmar_elena_returnothercup_17_00","",""
"Scripts/Content/Story/Dialoge/City/Harbour/DIA_VLK_Lehmar.d:464","Да, черт побери! Где он?","Jasne, że tak! Gdzie on jest?","","False","dia_lehmar_elena_returnothercup_09_01","",""
"Scripts/Content/Story/Dialoge/City/Harbour/DIA_VLK_Lehmar.d:465","Он у меня.","Mam go.","","False","dia_lehmar_elena_returnothercup_17_02","",""
"Scripts/Content/Story/Dialoge/City/Harbour/DIA_VLK_Lehmar.d:466","Сколько ты за него хочешь?","Ile za niego chcesz?","","False","dia_lehmar_elena_returnothercup_09_03","",""
"Scripts/Content/Story/Dialoge/City/Harbour/DIA_VLK_Lehmar.d:468","Забирай так.","Nic, weź go sobie.","","False","dia_lehmar_elena_returnothercup.dia_lehmar_elena_returnothercup0","Info_AddChoice",""
"Scripts/Content/Story/Dialoge/City/Harbour/DIA_VLK_Lehmar.d:469","1000 золотых.","1000 sztuk złota.","","False","dia_lehmar_elena_returnothercup.dia_lehmar_elena_returnothercup1000","Info_AddChoice",""
"Scripts/Content/Story/Dialoge/City/Harbour/DIA_VLK_Lehmar.d:470","850 золотых.","850 sztuk złota.","","False","dia_lehmar_elena_returnothercup.dia_lehmar_elena_returnothercup850","Info_AddChoice",""
"Scripts/Content/Story/Dialoge/City/Harbour/DIA_VLK_Lehmar.d:471","500 золотых.","500 sztuk złota.","","False","dia_lehmar_elena_returnothercup.dia_lehmar_elena_returnothercup500","Info_AddChoice",""
"Scripts/Content/Story/Dialoge/City/Harbour/DIA_VLK_Lehmar.d:472","350 золотых.","350 sztuk złota.","","False","dia_lehmar_elena_returnothercup.dia_lehmar_elena_returnothercup350","Info_AddChoice",""
"Scripts/Content/Story/Dialoge/City/Harbour/DIA_VLK_Lehmar.d:476","350 золотых.","350 sztuk złota.","","False","dia_lehmar_elena_returnothercup350_17_00","",""
"Scripts/Content/Story/Dialoge/City/Harbour/DIA_VLK_Lehmar.d:477","Хорошо. Вот твое золото. А теперь уходи, я хочу побыть один.","W porządku. Trzymaj złoto. A teraz odejdź, chcę pobyć sam.","","False","dia_lehmar_elena_returnothercup350_09_01","",""
"Scripts/Content/Story/Dialoge/City/Harbour/DIA_VLK_Lehmar.d:485","500 золотых.","500 sztuk złota.","","False","dia_lehmar_elena_returnothercup500_17_00","",""
"Scripts/Content/Story/Dialoge/City/Harbour/DIA_VLK_Lehmar.d:486","Ладно. Держи деньги и убирайся с глаз моих!","W porządku. Bierz złoto i zejdź mi z oczu!","","False","dia_lehmar_elena_returnothercup500_09_01","",""
"Scripts/Content/Story/Dialoge/City/Harbour/DIA_VLK_Lehmar.d:493","850 золотых.","850 sztuk złota.","","False","dia_lehmar_elena_returnothercup850_17_00","",""
"Scripts/Content/Story/Dialoge/City/Harbour/DIA_VLK_Lehmar.d:494","Сколько?!","Ile?!","","False","dia_lehmar_elena_returnothercup850_09_01","",""
"Scripts/Content/Story/Dialoge/City/Harbour/DIA_VLK_Lehmar.d:495","Ровно во столько мне обошлись оба кубка. Я просто хочу вернуть мои деньги.","Dokładnie tyle kosztowały mnie oba puchary. Chcę tylko odzyskać swoje złoto.","","False","dia_lehmar_elena_returnothercup850_17_02","",""
"Scripts/Content/Story/Dialoge/City/Harbour/DIA_VLK_Lehmar.d:496","(скрипя зубами) Хорошо. Держи деньги и катись отсюда.","W porządku. Bierz złoto i wynoś się stąd.","","False","dia_lehmar_elena_returnothercup850_09_03","",""
"Scripts/Content/Story/Dialoge/City/Harbour/DIA_VLK_Lehmar.d:503","1000 золотых.","1000 sztuk złota.","","False","dia_lehmar_elena_returnothercup1000_17_00","",""
"Scripts/Content/Story/Dialoge/City/Harbour/DIA_VLK_Lehmar.d:504","Что?! Да ты совсем сдурела?","Co?! To jest grabież?","","False","dia_lehmar_elena_returnothercup1000_09_01","",""
"Scripts/Content/Story/Dialoge/City/Harbour/DIA_VLK_Lehmar.d:505","Думаешь, если я ростовщик, то у меня любые деньги есть?","Myślisz, że jak już jestem lichwiarzem, to mam góry złota?","","False","dia_lehmar_elena_returnothercup1000_09_02","",""
"Scripts/Content/Story/Dialoge/City/Harbour/DIA_VLK_Lehmar.d:506","Да мне тебя убить дешевле. Уйди от греха!","Byłoby taniej, gdybym cię zabił. Zejdź mi z oczu!","","False","dia_lehmar_elena_returnothercup1000_09_03","",""
"Scripts/Content/Story/Dialoge/City/Harbour/DIA_VLK_Lehmar.d:511","Забирай так.","Nic, weź go sobie.","","False","dia_lehmar_elena_returnothercup0_17_00","",""
"Scripts/Content/Story/Dialoge/City/Harbour/DIA_VLK_Lehmar.d:513","Не пойму, ты совсем дура или святая?","Nie pojmuję... To twoja głupota, czy świętość?","","False","dia_lehmar_elena_returnothercup0_09_01","",""
"Scripts/Content/Story/Dialoge/City/Harbour/DIA_VLK_Lehmar.d:514","Вот, возьми 500 золотых. Бери, и больше не появляйся!","Masz tu 500 sztuk złota. Bierz i więcej nie wracaj!","","False","dia_lehmar_elena_returnothercup0_09_02","",""
"Scripts/Content/Story/Dialoge/City/Harbour/DIA_VLK_Lehmar.d:543","Оставь меня в покое!","Zostaw mnie w spokoju!","","False","dia_lehmar_elena_getout_09_00","",""
"Scripts/Content/Story/Dialoge/City/Harbour/DIA_VLK_Lehmar.d:570","Хочешь занять денег?","Chcesz pożyczyć złoto?","","False","dia_lehmar_others_mr_hello_09_00","",""
"Scripts/Content/Story/Dialoge/City/Harbour/DIA_VLK_Lehmar.d:572","Нет.","Nie.","","False","dia_lehmar_others_mr_hello_03_01","",""
"Scripts/Content/Story/Dialoge/City/Harbour/DIA_VLK_Lehmar.d:574","Нет.","Nie.","","False","dia_lehmar_others_mr_hello_07_01","",""
"Scripts/Content/Story/Dialoge/City/Harbour/DIA_VLK_Lehmar.d:576","Нет.","Nie.","","False","dia_lehmar_others_mr_hello_10_01","",""
"Scripts/Content/Story/Dialoge/City/Harbour/DIA_VLK_Lehmar.d:578","Нет.","Nie.","","False","dia_lehmar_others_mr_hello_14_01","",""
"Scripts/Content/Story/Dialoge/City/Harbour/DIA_VLK_Lehmar.d:580","Нет.","Nie.","","False","dia_lehmar_others_mr_hello_16_01","",""
"Scripts/Content/Story/Dialoge/City/Harbour/DIA_VLK_Lehmar.d:582","Тогда не мельтеши перед глазами.","Więc zejdź mi z oczu.","","False","dia_lehmar_others_mr_hello_09_02","",""
"Scripts/Content/Story/Dialoge/City/Harbour/DIA_VLK_Lucia.d:13","Эй, ты Люсия?","Ej, to ty jesteś Lucia?","","False","dia_lucia_sarah_hello.description","",""
"Scripts/Content/Story/Dialoge/City/Harbour/DIA_VLK_Lucia.d:32","Эй, ты Люсия?","Ej, to ty jesteś Lucia?","","False","dia_lucia_sarah_mr_hello_16_00","",""
"Scripts/Content/Story/Dialoge/City/Harbour/DIA_VLK_Lucia.d:33","Ну я.","Tak, to ja.","","False","dia_lucia_sarah_mr_hello_16_01","",""
"Scripts/Content/Story/Dialoge/City/Harbour/DIA_VLK_Lucia.d:34","Есть деловое предложение. Я хочу, чтобы Надя бросила курить.","Mam dla ciebie propozycję. Chcę, żeby Nadja przestała palić.","","False","dia_lucia_sarah_mr_hello_16_02","",""
"Scripts/Content/Story/Dialoge/City/Harbour/DIA_VLK_Lucia.d:35","А мне какое дело?","A co mi do tego?","","False","dia_lucia_sarah_mr_hello_16_03","",""
"Scripts/Content/Story/Dialoge/City/Harbour/DIA_VLK_Lucia.d:36","Поспорь с ней, что она не сможет бросить.","Załóż się z nią, że nie rzuci palenia.","","False","dia_lucia_sarah_mr_hello_16_04","",""
"Scripts/Content/Story/Dialoge/City/Harbour/DIA_VLK_Lucia.d:37","Если выиграешь - получишь деньги от нее, если проиграешь - я заплачу тебе вдвое сверх проигрыша.","Jeśli wygrasz, dostaniesz od niej złoto, jeśli przegrasz, otrzymasz ode mnie podwójną stawkę.","","False","dia_lucia_sarah_mr_hello_16_05","",""
"Scripts/Content/Story/Dialoge/City/Harbour/DIA_VLK_Lucia.d:38","В любом случае, в накладе не останешься.","Tak czy inaczej, nie zostaniesz bez zarobku.","","False","dia_lucia_sarah_mr_hello_16_06","",""
"Scripts/Content/Story/Dialoge/City/Harbour/DIA_VLK_Lucia.d:39","Хм, поиздеваться над Надей и мне за это еще и заплатят? Звучит заманчиво.","Hmm, założyć się z Nadją i jeszcze mi za to zapłacą? Brzmi kusząco.","","False","dia_lucia_sarah_mr_hello_16_07","",""
"Scripts/Content/Story/Dialoge/City/Harbour/DIA_VLK_Lucia.d:40","Но золото у меня есть. Я хочу кое-что другое.","Ale ja mam złoto. Chcę czegoś innego.","","False","dia_lucia_sarah_mr_hello_16_08","",""
"Scripts/Content/Story/Dialoge/City/Harbour/DIA_VLK_Lucia.d:41","Недавно у Бромора пропал ключ. Одна птичка шепнула мне, что этот ключ спрятан где-то в порту, неподалеку.","Niedawno Bromor zagubił klucz. Ptaszki ćwierkały, że klucz jest gdzieś w pobliskim porcie.","","False","dia_lucia_sarah_mr_hello_16_09","",""
"Scripts/Content/Story/Dialoge/City/Harbour/DIA_VLK_Lucia.d:42","Найди его и принеси мне. Это большой стальной ключ, а на рукоятке выцарапана буква Б.","Znajdź go i przynieś do mnie. To duży stalowy klucz, na uchwycie widnieje wydrapana litera B.","","False","dia_lucia_sarah_mr_hello_16_10","",""
"Scripts/Content/Story/Dialoge/City/Harbour/DIA_VLK_Lucia.d:52","Этот ключ?","To ten klucz?","","False","dia_lucia_sarah_givekey.description","",""
"Scripts/Content/Story/Dialoge/City/Harbour/DIA_VLK_Lucia.d:70","Этот ключ?","To ten klucz?","","False","dia_lucia_sarah_givekey_16_00","",""
"Scripts/Content/Story/Dialoge/City/Harbour/DIA_VLK_Lucia.d:72","Да, это он. Что ж, уговор есть уговор - я сегодня же пообщаюсь с Надей.","Tak. Cóż, umowa to umowa. Porozmawiam dzisiaj z Nadją.","","False","dia_lucia_sarah_givekey_16_01","",""
"Scripts/Content/Story/Dialoge/City/Harbour/DIA_VLK_Lucia.d:73","Но если она проспорит, это не мои проблемы.","Ale jeśli ona przegra, to nie mój problem.","","False","dia_lucia_sarah_givekey_16_02","",""
"Scripts/Content/Story/Dialoge/City/Harbour/DIA_VLK_Lucia.d:104","А ты тут что забыла?","Co ty tu robisz?","","False","dia_lucia_female_hello_16_01","",""
"Scripts/Content/Story/Dialoge/City/Harbour/DIA_VLK_Lucia.d:107","Мальчик, ты заблудился?","Nie wiesz gdzie jesteś?","","False","dia_lucia_till_hello_16_01","",""
"Scripts/Content/Story/Dialoge/City/Harbour/DIA_VLK_Lucia.d:110","Я занята, милый.","Jestem zajęta.","","False","dia_lucia_male_hello_16_01","",""
"Scripts/Content/Story/Dialoge/City/Harbour/DIA_VLK_Meldor.d:21","Эй, как там тебя... Руперт! ","Ej, jak tam ciebie wołają? A, Rupert!","","False","dia_meldor_rupert_mr_hello_09_00","",""
"Scripts/Content/Story/Dialoge/City/Harbour/DIA_VLK_Meldor.d:22","Лемар хочет тебя видеть. Если ты забыл, ты должен ему кучу денег.","Lehmar chce cię widzieć. Jeśli nie pamiętasz, to ci przypominam, że masz spory dług u niego.","","False","dia_meldor_rupert_mr_hello_09_01","",""
"Scripts/Content/Story/Dialoge/City/Harbour/DIA_VLK_Meldor.d:45","Эй! Лемар хочет с тобой поговорить. ","Ej, ty! Lehmar chce z tobą pogadać.","","False","dia_meldor_rupert_lehmarwaits_09_00","",""
"Scripts/Content/Story/Dialoge/City/Harbour/DIA_VLK_Meldor.d:46","Не знаю, что там у вас за дела, но таким разозленным я его никогда не видел.","Nie wiem, o co mu chodzi, ale nigdy nie był tak wkurzony.","","False","dia_meldor_rupert_lehmarwaits_09_01","",""
