"location","source","target","id","fuzzy","context","translator_comments","developer_comments"
"Scripts/Content/Story/Log_Entries/LOG_Constants_Notes.d:348","В стае около полудюжины волков.","","","False","topic_malethwolves_number","",""
"Scripts/Content/Story/Log_Entries/LOG_Constants_Notes.d:349","Рассчитывать на щедрую награду не стоит.","","","False","topic_malethwolves_payment","",""
"Scripts/Content/Story/Log_Entries/LOG_Constants_Notes.d:350","Кажется, все волки мертвы.","","","False","topic_malethwolves_killed","",""
"Scripts/Content/Story/Log_Entries/LOG_Constants_Notes.d:351","Возле фермы Лобарта ошивалась большая стая волков. Надо поговорить с пастухом.","","","False","topic_malethwolves_killed2","",""
"Scripts/Content/Story/Log_Entries/LOG_Constants_Notes.d:352","Малет отдал мне все свои деньги, 7 золотых.","","","False","topic_malethwolves_paid","",""
"Scripts/Content/Story/Log_Entries/LOG_Constants_Notes.d:353","Малет обещал каждый день делиться со мной обедом, пока его овцы целы.","","","False","topic_malethwolves_food","",""
"Scripts/Content/Story/Log_Entries/LOG_Constants_Notes.d:354","Малет погиб. Волки его больше не волнуют.","","","False","topic_malethwolves_fail_dead","",""
"Scripts/Content/Story/Log_Entries/LOG_Constants_Notes.d:357","Кулинарные изыски","","","False","topic_cookery","",""
"Scripts/Content/Story/Log_Entries/LOG_Constants_Notes.d:358","Лесоруб Гром нашел на пеньках розовые грибы, похожие на уши. Он хочет знать, съедобны ли они, и как их лучше готовить.","","","False","topic_cookery_start","",""
"Scripts/Content/Story/Log_Entries/LOG_Constants_Notes.d:359","Гром посоветовал поспрашивать рецепты в первую очередь у Теклы и крестьянок на других фермах, а еще у лесной ведьмы Сагитты и у алхимиков.","","","False","topic_cookery_wheresearch","",""
"Scripts/Content/Story/Log_Entries/LOG_Constants_Notes.d:361","Константино сказал, что в сыром виде дамские уши вредны для магических способностей. Но если вымочить их в трех водах по три часа, все вредные эффекты пропадут. А еще он упомянул какую-то настойку...","","","False","topic_cookery_constantino","",""
"Scripts/Content/Story/Log_Entries/LOG_Constants_Notes.d:362","Константино готов продать рецепт настойки на дамском ушке за 500 золотых.","","","False","topic_cookery_constantinorecipeprice","",""
"Scripts/Content/Story/Log_Entries/LOG_Constants_Notes.d:363","Рецепт настойки Константино у меня. Надо отдать его Грому.","","","False","topic_cookery_constantinogot","",""
"Scripts/Content/Story/Log_Entries/LOG_Constants_Notes.d:364","Грома сильно заинтересовал рецепт настойки на грибах. Он даже подарил мне пояс охотника.","","","False","topic_cookery_constantinogiven","",""
"Scripts/Content/Story/Log_Entries/LOG_Constants_Notes.d:366","Текла попытается приготовить дамские уши, если я наверняка узнаю, съедобные ли они.","","","False","topic_cookery_theklaeatable","",""
"Scripts/Content/Story/Log_Entries/LOG_Constants_Notes.d:367","Текла попытается приготовить грибы. На пробу ей нужно 3 штуки.","","","False","topic_cookery_theklaneed3","",""
"Scripts/Content/Story/Log_Entries/LOG_Constants_Notes.d:368","Текла взялась за готовку. Надо будет зайти к ней завтра после полудня.","","","False","topic_cookery_theklatry","",""
"Scripts/Content/Story/Log_Entries/LOG_Constants_Notes.d:369","У Теклы получились жареные уши. На вид довольно... оригинально, но пахнет вкусно. Надо отдать рецепт Грому.","","","False","topic_cookery_theklaready","",""
"Scripts/Content/Story/Log_Entries/LOG_Constants_Notes.d:370","Гром был уверен, что Текла приготовит что-то вкусное. В награду он дал мне пригорошню лесных ягод.","","","False","topic_cookery_theklagiven","",""
"Scripts/Content/Story/Log_Entries/LOG_Constants_Notes.d:371","Рецепт Теклы я уже никогда не узнаю...","","","False","topic_cookery_thekladead","",""
"Scripts/Content/Story/Log_Entries/LOG_Constants_Notes.d:373","Сагитта посоветовала жарить дамские уши с коричневым масляком. Масляков нужно взять вдвое больше, чем ушек. Ушки сначала отварить в крепко соленой воде.","","","False","topic_cookery_sagitta","",""
"Scripts/Content/Story/Log_Entries/LOG_Constants_Notes.d:374","За рецепт Сагитты Гром дал мне разных грибов, которые он собрал в лесу.","","","False","topic_cookery_sagittatold","",""
"Scripts/Content/Story/Log_Entries/LOG_Constants_Notes.d:375","Грому нужны специи, чтобы приготовить грибное рагу. Что-нибудь острое.","","","False","topic_cookery_askspices","",""
"Scripts/Content/Story/Log_Entries/LOG_Constants_Notes.d:376","Красный жгучий перец пришелся Грому по вкусу.","","","False","topic_cookery_spicesgiven","",""
"Scripts/Content/Story/Log_Entries/LOG_Constants_Notes.d:377","Маленькие ночные искры на вкус острые и жгучие, почти как перец.","","","False","topic_cookery_nsparklesknown","",""
"Scripts/Content/Story/Log_Entries/LOG_Constants_Notes.d:378","Да, приправа к грибам из грибов - звучит немного странно, но Грому пришлось по вкусу.","","","False","topic_cookery_nsparklesgiven","",""
"Scripts/Content/Story/Log_Entries/LOG_Constants_Notes.d:379","Сагитта погибла. А она могла знать какой-то рецепт...","","","False","topic_cookery_sagittadead","",""
"Scripts/Content/Story/Log_Entries/LOG_Constants_Notes.d:381","У Хильды есть бабушкин рецепт маринованых “ушек“. Она отдаст его мне, если я заточу ее кухонный нож у кузнеца.","","","False","topic_cookery_hilda","",""
"Scripts/Content/Story/Log_Entries/LOG_Constants_Notes.d:382","Рецепт Хильды у меня. Надо отнести его Грому.","","","False","topic_cookery_hildaget","",""
"Scripts/Content/Story/Log_Entries/LOG_Constants_Notes.d:383","За рецепт маринованых грибов Гром дал мне полсотни стрел.","","","False","topic_cookery_hildagiven","",""
"Scripts/Content/Story/Log_Entries/LOG_Constants_Notes.d:384","Рецепт Хильды утрачен для мира.","","","False","topic_cookery_hildadead","",""
"Scripts/Content/Story/Log_Entries/LOG_Constants_Notes.d:386","Больше рецептов мне не найти.","","","False","topic_cookery_success","",""
"Scripts/Content/Story/Log_Entries/LOG_Constants_Notes.d:387","Рецепты Грому больше не нужны. Покойся с миром.","","","False","topic_cookery_fail_gromdead","",""
"Scripts/Content/Story/Log_Entries/LOG_Constants_Notes.d:390","Плотник на мели","","","False","topic_thorbensales","",""
"Scripts/Content/Story/Log_Entries/LOG_Constants_Notes.d:391","Плотник Торбен никак не может продать изготовленную мебель. Возможно, я смогу найти покупателей. У него есть готовый стол, стулья, комоды, шкаф и сундуки.","","","False","topic_thorbensales_start","",""
"Scripts/Content/Story/Log_Entries/LOG_Constants_Notes.d:394","Как вернуть мужа домой","","","False","topic_fellangohome","",""
"Scripts/Content/Story/Log_Entries/LOG_Constants_Notes.d:395","Ирина никак не может вернуть мужа домой. Феллан ушел из дому и поселился прямо на причале с твердым намерением уплыть с острова. Говорят, он всегда был странным, а теперь окончательно тронулся умом.","","","False","topic_fellangohome_start","",""
"Scripts/Content/Story/Log_Entries/LOG_Constants_Notes.d:396","Уговоры на Феллана не действуют, он ведет себя как окончательно спятивший. Нужно придумать какую-то уловку. Посоветуюсь с Ириной, она все-таки его жена.","","","False","topic_fellangohome_talkfail","",""
"Scripts/Content/Story/Log_Entries/LOG_Constants_Notes.d:397","Ирина рассказала, что Феллан был очень привязан к разным старым вещам, а особенно - к молотку своего деда. Молоток лежит в сундуке Феллана вместе с остальным хламом.","","","False","topic_fellangohome_hammertold","",""
"Scripts/Content/Story/Log_Entries/LOG_Constants_Notes.d:398","Молоток у меня. Увы, рукоятка сломана посередине. Нужно его починить, да так, чтобы стал как новенький.","","","False","topic_fellangohome_hammerbroken","",""
"Scripts/Content/Story/Log_Entries/LOG_Constants_Notes.d:399","Кузнец Карл из Портового квартала должен суметь починить молоток.","","","False","topic_fellangohome_hammersmith","",""
"Scripts/Content/Story/Log_Entries/LOG_Constants_Notes.d:400","Карл может починить молоток, но у него нет точно такой же древесины для рукоятки. Нужно поговорить с плотником Торбеном.","","","False","topic_fellangohome_hammercarl","",""
"Scripts/Content/Story/Log_Entries/LOG_Constants_Notes.d:401","Торбен уверяет, что рукоятка сделана из тиса. К несчастью, тис уже давно не растет на Хоринисе и у Торбена его нет. Из тиса делают луки, а еще его называют негной-дерево, потому что он не портится в воде.","","","False","topic_fellangohome_hammerthorben","",""
"Scripts/Content/Story/Log_Entries/LOG_Constants_Notes.d:402","У Боспера нет древесины тиса, а если бы и была, то не подошла бы для рукояти - луки изготавливают из другой части. Он посоветовал поспрашивать в порту - из тиса иногда делают сваи и лодки.","","","False","topic_fellangohome_hammerbosper","",""
"Scripts/Content/Story/Log_Entries/LOG_Constants_Notes.d:403","Нужно спросить Фабио и Бруно, у рабочих на верфи.","","","False","topic_fellangohome_hammerhafenasked","",""
"Scripts/Content/Story/Log_Entries/LOG_Constants_Notes.d:404","У работников в Порту есть небольшой запас тиса. Я могу купить чурбак за 50 золотых.","","","False","topic_fellangohome_hammerhafen","",""
"Scripts/Content/Story/Log_Entries/LOG_Constants_Notes.d:405","Теперь у меня есть древесина для рукоятки.","","","False","topic_fellangohome_hammeryew","",""
"Scripts/Content/Story/Log_Entries/LOG_Constants_Notes.d:406","Готово! Молоток как новенький.","","","False","topic_fellangohome_hammerrepaired","",""
"Scripts/Content/Story/Log_Entries/LOG_Constants_Notes.d:407","Феллан не поддался на уловку с молотком, хотя и заколебался. Кажется, я что-то упускаю...","","","False","topic_fellangohome_hammerfail","",""
"Scripts/Content/Story/Log_Entries/LOG_Constants_Notes.d:408","Ирина вспомнила кое-что интересное. Дед Феллана любил повторять, что старые вещи, как и отношения между людьми, нужно всегда чинить, а не выбрасывать. Феллан всегда старался следовать наказу деда. Думаю, теперь я знаю, как его уговорить.","","","False","topic_fellangohome_clue","",""
"Scripts/Content/Story/Log_Entries/LOG_Constants_Notes.d:409","Сработало! Феллан вернулся домой. Надо будет проведать Ирину.","","","False","topic_fellangohome_success","",""
"Scripts/Content/Story/Log_Entries/LOG_Constants_Notes.d:410","Ирина выглядит очень счастливой.","","","False","topic_fellangohome_successirene","",""
"Scripts/Content/Story/Log_Entries/LOG_Constants_Notes.d:411"," Она подарила мне амулет на удачу, который Феллан починил первым делом.","","","False","topic_fellangohome_successamul","",""
"Scripts/Content/Story/Log_Entries/LOG_Constants_Notes.d:412","Феллан умер. Ирина с ума сойдет от горя. Не смогу ей сказать.","","","False","topic_fellangohome_fail_deadfellan","",""
"Scripts/Content/Story/Log_Entries/LOG_Constants_Notes.d:413","Ирина погибла. Интересно, Феллан хотя бы заметит?","","","False","topic_fellangohome_fail_deadirene","",""
"Scripts/Content/Story/Log_Entries/LOG_Constants_Notes.d:414","Ну и как теперь починить молоток?","","","False","topic_fellangohome_fail_hummer","",""
"Scripts/Content/Story/Log_Entries/LOG_Constants_Notes.d:418","А где Трокар?","","","False","topic_findtrocar","",""
"Scripts/Content/Story/Log_Entries/LOG_Constants_Notes.d:419","Барток, ученик Боспера, попросил найти своего друга, Трокара, и передать ему, что он забыл свой нож на стойке у Орлана. Трокар уже несколько дней охотится где-то один. ","","","False","topic_findtrocar_start","",""
"Scripts/Content/Story/Log_Entries/LOG_Constants_Notes.d:420","Трокар забрался в самую дальнюю часть острова в погоне за раненым секачом. Это же надо было - три дня идти по следу и выжидать его, сидя на дереве!","","","False","topic_findtrocar_found","",""
"Scripts/Content/Story/Log_Entries/LOG_Constants_Notes.d:421","Я сказал Трокару про нож.","","","False","topic_findtrocar_told","",""
"Scripts/Content/Story/Log_Entries/LOG_Constants_Notes.d:422","Я сказала Трокару про нож.","","","False","topic_findtrocar_told_f","",""
"Scripts/Content/Story/Log_Entries/LOG_Constants_Notes.d:423","Нож Трокару больше не понадобится...","","","False","topic_findtrocar_faildead","",""
"Scripts/Content/Story/Log_Entries/LOG_Constants_Notes.d:428","Свободное время","","","False","topic_freetime","",""
"Scripts/Content/Story/Log_Entries/LOG_Constants_Notes.d:429","Конкурс Константино завершен, но жизнь продолжается! Вы вольны оставаться на осеннем Хоринисе сколько душе угодно.","","","False","topic_freetime_start","",""
"Scripts/Content/Story/Log_Entries/LOG_Constants_Notes.d:431","Торговля","","","False","topic_trader","",""
"Scripts/Content/Story/Log_Entries/LOG_Constants_Notes.d:432","Боспер продает луки и покупает шкуры.","","","False","topic_trader_bosper","",""
"Scripts/Content/Story/Log_Entries/LOG_Constants_Notes.d:433","В таверне “Мертвая гарпия“ можно купить еду и другие полезные товары.","","","False","topic_trader_orlan","",""
"Scripts/Content/Story/Log_Entries/LOG_Constants_Notes.d:434","Саландрил из Верхнего квартала продает зелья и травы.","","","False","topic_trader_salandril","",""
"Scripts/Content/Story/Log_Entries/LOG_Constants_Notes.d:435","Бальтрам продает продукты на рыночной площади.","","","False","topic_trader_baltram","",""
"Scripts/Content/Story/Log_Entries/LOG_Constants_Notes.d:436","Зурис с рыночной площади продает лечебные зелья и травы.","","","False","topic_trader_zuris","",""
"Scripts/Content/Story/Log_Entries/LOG_Constants_Notes.d:437","Константино может продать мне кое-какие зелья.","","","False","topic_trader_constantino","",""
"Scripts/Content/Story/Log_Entries/LOG_Constants_Notes.d:438","В трактире Корагона всегда свежее пиво и хорошая еда.","","","False","topic_trader_coragon","",""
"Scripts/Content/Story/Log_Entries/LOG_Constants_Notes.d:439","Йора продает продукты и разные мелочи на рыночной площади.","","","False","topic_trader_jora","",""
"Scripts/Content/Story/Log_Entries/LOG_Constants_Notes.d:440","Хакон продает оружие на рыночной площади.","","","False","topic_trader_hakon","",""
"Scripts/Content/Story/Log_Entries/LOG_Constants_Notes.d:441","Кантар торгует оружием на рыночной площади.","","","False","topic_trader_canthar","",""
"Scripts/Content/Story/Log_Entries/LOG_Constants_Notes.d:442","Маттео из Нижнего квартала продает одежду и хозяйственные принадлежности. У него также есть кожаная броня.","","","False","topic_trader_matteo","",""
"Scripts/Content/Story/Log_Entries/LOG_Constants_Notes.d:443","Онар может продать мне свежие продукты.","","","False","topic_trader_erol","",""
"Scripts/Content/Story/Log_Entries/LOG_Constants_Notes.d:444","“Честный торговец“, скрывающийся в лесу, продает разные вещи, которые трудно достать в городе.","","","False","topic_trader_chief","",""
"Scripts/Content/Story/Log_Entries/LOG_Constants_Notes.d:445","Я могу купить свитки и целебные зелья у мастера Горакса.","","","False","topic_trader_gorax","",""
"Scripts/Content/Story/Log_Entries/LOG_Constants_Notes.d:446","Исгарот, что молится в часовне возле Монастыря, может продать мне магические свитки.","","","False","topic_trader_isgaroth","",""
"Scripts/Content/Story/Log_Entries/LOG_Constants_Notes.d:447","В портовом кабаке продают, естественно, выпивку.","","","False","topic_trader_kardif","",""
"Scripts/Content/Story/Log_Entries/LOG_Constants_Notes.d:448","Игнац продает зелья и редкие свитки в портовом квартале.","","","False","topic_trader_ignaz","",""
"Scripts/Content/Story/Log_Entries/LOG_Constants_Notes.d:449","Ибрагим из портового квартала рисует и продает карты.","","","False","topic_trader_brahim","",""
"Scripts/Content/Story/Log_Entries/LOG_Constants_Notes.d:450","Феня продает продукты в портовом квартале.","","","False","topic_trader_fenia","",""
"Scripts/Content/Story/Log_Entries/LOG_Constants_Notes.d:451","Халвор торгует рыбой в портовом квартале.","","","False","topic_trader_halvor","",""
"Scripts/Content/Story/Log_Entries/LOG_Constants_Notes.d:452","Лютеро из верхнего квартала продает различные редкости.","","","False","topic_trader_lutero","",""
"Scripts/Content/Story/Log_Entries/LOG_Constants_Notes.d:453","Я могу купить продукты у фермера Лобарта, но только за золото - у меня он брать ничего не будет.","","","False","topic_trader_lobart","",""
"Scripts/Content/Story/Log_Entries/LOG_Constants_Notes.d:454","Я, как всегда, могу купить продукты у Онара.","","","False","topic_trader_onar","",""
"Scripts/Content/Story/Log_Entries/LOG_Constants_Notes.d:455","Брайан готов продать мне охотничий нож, но так, чтобы его учитель Гарад не увидел.","","","False","topic_trader_brian","",""
"Scripts/Content/Story/Log_Entries/LOG_Constants_Notes.d:456","Никлас готов обменять грибы, которые он нашел в лесу на любую еду, кроме мяса.","","","False","topic_trader_niclas","",""
"Scripts/Content/Story/Log_Entries/LOG_Constants_Notes.d:457","Талбин может продать мне свои грибы, но он хочет получить больше золота, чем у Константино.","","","False","topic_trader_talbin","",""
"Scripts/Content/Story/Log_Entries/LOG_Constants_Notes.d:458","Руперт продаст мне свои грибы по той же цене, что и Константино.","","","False","topic_trader_rupert","",""
"Scripts/Content/Story/Log_Entries/LOG_Constants_Notes.d:459","После конкурса Сара вернулась к ремеслу торговки. У нее можно купить оружие и продукты.","","","False","topic_trader_sarah","",""
"Scripts/Content/Story/Log_Entries/LOG_Constants_Notes.d:461","Обучение и тренировки","","","False","topic_teacher","",""
"Scripts/Content/Story/Log_Entries/LOG_Constants_Notes.d:462","Чем больше я использую какое-то оружие, тем лучше им владею. Магические способности тоже поддаются тренировке.","","","False","topic_teacher_self","",""
"Scripts/Content/Story/Log_Entries/LOG_Constants_Notes.d:463","Я могу потренироваться в стрельбе по мишеням рядом с казармами.","","","False","topic_teacher_ruga","",""
"Scripts/Content/Story/Log_Entries/LOG_Constants_Notes.d:464","Стражник Пек согласился потренировать меня. Он будет ждать каждый вечер на площадке между казармами и портом, под большим деревом.","","","False","topic_teacher_peck","",""
"Scripts/Content/Story/Log_Entries/LOG_Constants_Notes.d:465","Вульфгар отказался тренировать меня.","","","False","topic_teacher_wulfgar","",""
"Scripts/Content/Story/Log_Entries/LOG_Constants_Notes.d:466","Пек больше не хочет тренировать меня.","","","False","topic_teacher_peckstop","",""
"Scripts/Content/Story/Log_Entries/LOG_Constants_Notes.d:467","Гримбальд может научить меня красться за 200 золотых.","","","False","topic_teacher_grimbald","",""
"Scripts/Content/Story/Log_Entries/LOG_Constants_Notes.d:468","Мастер Неорас может обучить меня основам алхимии.","","","False","topic_teacher_neoras","",""
"Scripts/Content/Story/Log_Entries/LOG_Constants_Notes.d:469","За 150 золотых Гаан, охотник с фермы у Прохода, научит меня извлекать жвала.","","","False","topic_teacher_gaan","",""
"Scripts/Content/Story/Log_Entries/LOG_Constants_Notes.d:471","Ночлег","","","False","topic_sleep","",""
"Scripts/Content/Story/Log_Entries/LOG_Constants_Notes.d:472","Если засветло мне не удалось добраться до кровати, можно прикорнуть у какого-нибудь костра.","","","False","topic_sleep_firecamp","",""
"Scripts/Content/Story/Log_Entries/LOG_Constants_Notes.d:473","В трактире “Спящий толстосум“ можно переночевать за 20 золотых в неделю.","","","False","topic_sleep_cityhotelprice","",""
"Scripts/Content/Story/Log_Entries/LOG_Constants_Notes.d:474","В городе я могу переночевать в трактире Ханны “Спящий толстосум“.","","","False","topic_sleep_cityhotel","",""
