"location","source","target","id","fuzzy","context","translator_comments","developer_comments"
"Scripts/Content/Story/Log_Entries/LOG_Constants_Notes.d:340","Мне встретился забавный крестьянин, Вино, пьяный в стельку. Стоит навестить его, когда он проспится. И поговорить с Лобартом - это, скорее всего, его работник.","Spotkał mnie Vino. To zabawny i pijany w sztok wieśniak. Warto go odwiedzić, gdy wytrzeźwieje. I trzeba porozmawiać z Lobartem - to najprawdopodobniej jego pracownik.","","False","topic_lostbau_found_1st","",""
"Scripts/Content/Story/Log_Entries/LOG_Constants_Notes.d:341","Лобарт чуть не придушил Вино, когда тот вернулся. То ли со злости, то ли от радости.","Lobart o mało nie udusił Vino, gdy ten wrócił. Nie wiadomo, czy ze złości, czy z radości.","","False","topic_lostbau_told","",""
"Scripts/Content/Story/Log_Entries/LOG_Constants_Notes.d:342","Вино пришел в себя настолько, что вспомнил про письмо для своих друзей. Думаю, с ним все будет в порядке.","Vino na tyle doszedł do siebie, że przypomniał sobie o liście do przyjaciół. Myślę, że nic mu nie będzie.","","False","topic_lostbau_letter","",""
"Scripts/Content/Story/Log_Entries/LOG_Constants_Notes.d:343","Вино погиб.","Vino nie żyje.","","False","topic_lostbau_fail_deadvino","",""
"Scripts/Content/Story/Log_Entries/LOG_Constants_Notes.d:346","Голодные волки","Głodne wilki","","False","topic_malethwolves","",""
"Scripts/Content/Story/Log_Entries/LOG_Constants_Notes.d:347","Стая волков постоянно задирает овец у пастуха Малета. Они приходят ночью, а днем где-то прячутся.","Stado wilków nieustannie nęka owce pasterza Maletha. Przychodzą w nocy i chowają się gdzieś za dnia.","","False","topic_malethwolves_start","",""
"Scripts/Content/Story/Log_Entries/LOG_Constants_Notes.d:348","В стае около полудюжины волков.","Wataha liczy około pół tuzina wilków.","","False","topic_malethwolves_number","",""
"Scripts/Content/Story/Log_Entries/LOG_Constants_Notes.d:349","Рассчитывать на щедрую награду не стоит.","Nie należy oczekiwać hojnej nagrody.","","False","topic_malethwolves_payment","",""
"Scripts/Content/Story/Log_Entries/LOG_Constants_Notes.d:350","Кажется, все волки мертвы.","Sądzę, że wszystkie wilki nie żyją.","","False","topic_malethwolves_killed","",""
"Scripts/Content/Story/Log_Entries/LOG_Constants_Notes.d:351","Возле фермы Лобарта ошивалась большая стая волков. Надо поговорить с пастухом.","W pobliżu farmy Lobarta pojawiła się duża wataha wilków. Trzeba o tym porozmawiać z pasterzem.","","False","topic_malethwolves_killed2","",""
"Scripts/Content/Story/Log_Entries/LOG_Constants_Notes.d:352","Малет отдал мне все свои деньги, 7 золотых.","Maleth dał mi wszystkie swoje pieniądze, całe siedem sztuk złota.","","False","topic_malethwolves_paid","",""
"Scripts/Content/Story/Log_Entries/LOG_Constants_Notes.d:353","Малет обещал каждый день делиться со мной обедом, пока его овцы целы.","Maleth obiecał dzielić się ze mną swoim prowiantem każdego dnia, dopóki jego owce będą bezpieczne.","","False","topic_malethwolves_food","",""
"Scripts/Content/Story/Log_Entries/LOG_Constants_Notes.d:354","Малет погиб. Волки его больше не волнуют.","Maleth nie żyje. Już go wilki nie obchodzą.","","False","topic_malethwolves_fail_dead","",""
"Scripts/Content/Story/Log_Entries/LOG_Constants_Notes.d:357","Кулинарные изыски","Kulinarne przysmaki","","False","topic_cookery","",""
"Scripts/Content/Story/Log_Entries/LOG_Constants_Notes.d:358","Лесоруб Гром нашел на пеньках розовые грибы, похожие на уши. Он хочет знать, съедобны ли они, и как их лучше готовить.","Drwal Grom znalazł na pniakach różowe grzyby, które wyglądają jak uszy. Chce wiedzieć, czy są jadalne i jak najlepiej je przyrządzić.","","False","topic_cookery_start","",""
"Scripts/Content/Story/Log_Entries/LOG_Constants_Notes.d:359","Гром посоветовал поспрашивать рецепты в первую очередь у Теклы и крестьянок на других фермах, а еще у лесной ведьмы Сагитты и у алхимиков.","Grom poradził, aby poprosić o przepisy przede wszystkim Theklę i gospodynie z innych gospodarstw, a także leśną znachorkę Sagittę oraz alchemików.","","False","topic_cookery_wheresearch","",""
"Scripts/Content/Story/Log_Entries/LOG_Constants_Notes.d:361","Константино сказал, что в сыром виде дамские уши вредны для магических способностей. Но если вымочить их в трех водах по три часа, все вредные эффекты пропадут. А еще он упомянул какую-то настойку...","Constantino powiedział, że surowe Babie uszy są szkodliwe dla magicznych zdolności. Jeśli jednak wymoczy się je w trzech wodach przez trzy godziny, wszystkie szkodliwe efekty znikną. Wspomniał też o jakiejś nalewce...","","False","topic_cookery_constantino","",""
"Scripts/Content/Story/Log_Entries/LOG_Constants_Notes.d:362","Константино готов продать рецепт настойки на дамском ушке за 500 золотых.","Za 500 sztuk złota, Constantino jest gotów sprzedać przepis na nalewkę z Babich uszu.","","False","topic_cookery_constantinorecipeprice","",""
"Scripts/Content/Story/Log_Entries/LOG_Constants_Notes.d:363","Рецепт настойки Константино у меня. Надо отдать его Грому.","Mam przepis na nalewkę Constantino. Trzeba go dać Gromowi.","","False","topic_cookery_constantinogot","",""
"Scripts/Content/Story/Log_Entries/LOG_Constants_Notes.d:364","Грома сильно заинтересовал рецепт настойки на грибах. Он даже подарил мне пояс охотника.","Grom był bardzo zainteresowany przepisem na nalewkę z grzybów. Dał mi nawet pas myśliwego.","","False","topic_cookery_constantinogiven","",""
"Scripts/Content/Story/Log_Entries/LOG_Constants_Notes.d:366","Текла попытается приготовить дамские уши, если я наверняка узнаю, съедобные ли они.","Thekla spróbuje przyrządzić Babie uszy, jeśli dowiem się, czy są jadalne.","","False","topic_cookery_theklaeatable","",""
"Scripts/Content/Story/Log_Entries/LOG_Constants_Notes.d:367","Текла попытается приготовить грибы. На пробу ей нужно 3 штуки.","Thekla spróbuje przyrządzić grzyby. Potrzebuje do tego trzech sztuk.","","False","topic_cookery_theklaneed3","",""
"Scripts/Content/Story/Log_Entries/LOG_Constants_Notes.d:368","Текла взялась за готовку. Надо будет зайти к ней завтра после полудня.","Thekla wzięła się do pracy. Mam do niej zajrzeć jutro po południu.","","False","topic_cookery_theklatry","",""
"Scripts/Content/Story/Log_Entries/LOG_Constants_Notes.d:369","У Теклы получились жареные уши. На вид довольно... оригинально, но пахнет вкусно. Надо отдать рецепт Грому.","Mam od Thekli usmażone uszy. Wyglądają dość... oryginalnie, ale pachną wspaniale. Trzeba dać przepis Gromowi.","","False","topic_cookery_theklaready","",""
"Scripts/Content/Story/Log_Entries/LOG_Constants_Notes.d:370","Гром был уверен, что Текла приготовит что-то вкусное. В награду он дал мне пригорошню лесных ягод.","Grom był pewien, że Thekla przygotuje coś pysznego. W nagrodę dał mi kilka leśnych jagód.","","False","topic_cookery_theklagiven","",""
"Scripts/Content/Story/Log_Entries/LOG_Constants_Notes.d:371","Рецепт Теклы я уже никогда не узнаю...","Już nigdy nie poznam przepisu Thekli...","","False","topic_cookery_thekladead","",""
"Scripts/Content/Story/Log_Entries/LOG_Constants_Notes.d:373","Сагитта посоветовала жарить дамские уши с коричневым масляком. Масляков нужно взять вдвое больше, чем ушек. Ушки сначала отварить в крепко соленой воде.","Sagitta zaleca smażenie Babich uszu z brązowym Maślakiem. Należy wziąć dwa razy więcej Maślaków niż Babich uszu. Najpierw trzeba obgotować Babie uszy w mocno osolonej wodzie.","","False","topic_cookery_sagitta","",""
"Scripts/Content/Story/Log_Entries/LOG_Constants_Notes.d:374","За рецепт Сагитты Гром дал мне разных грибов, которые он собрал в лесу.","Za przepis od Sagitty, Grom dał mi rozmaite grzyby, które zebrał w lesie.","","False","topic_cookery_sagittatold","",""
"Scripts/Content/Story/Log_Entries/LOG_Constants_Notes.d:375","Грому нужны специи, чтобы приготовить грибное рагу. Что-нибудь острое.","Grom potrzebuje przypraw do gulaszu grzybowego. Coś pikantnego.","","False","topic_cookery_askspices","",""
"Scripts/Content/Story/Log_Entries/LOG_Constants_Notes.d:376","Красный жгучий перец пришелся Грому по вкусу.","Czerwony ostry pieprz przypadł do gustu Gromowi.","","False","topic_cookery_spicesgiven","",""
"Scripts/Content/Story/Log_Entries/LOG_Constants_Notes.d:377","Маленькие ночные искры на вкус острые и жгучие, почти как перец.","Małe Nocne skry są ostre i palące, prawie jak czerwony pieprz.","","False","topic_cookery_nsparklesknown","",""
"Scripts/Content/Story/Log_Entries/LOG_Constants_Notes.d:378","Да, приправа к грибам из грибов - звучит немного странно, но Грому пришлось по вкусу.","Tak, przyprawa grzybowa z grzybów - brzmi trochę dziwnie, ale Gromowi przypadła do gustu.","","False","topic_cookery_nsparklesgiven","",""
"Scripts/Content/Story/Log_Entries/LOG_Constants_Notes.d:379","Сагитта погибла. А она могла знать какой-то рецепт...","Sagitta nie żyje. A ona mogła znać jakiś przepis...","","False","topic_cookery_sagittadead","",""
"Scripts/Content/Story/Log_Entries/LOG_Constants_Notes.d:381","У Хильды есть бабушкин рецепт маринованых “ушек“. Она отдаст его мне, если я заточу ее кухонный нож у кузнеца.","Hilda ma przepis swojej babci na marynowane Babie uszy. Da mi go, jeśli u kowala naostrzę jej nóż kuchenny.","","False","topic_cookery_hilda","",""
"Scripts/Content/Story/Log_Entries/LOG_Constants_Notes.d:382","Рецепт Хильды у меня. Надо отнести его Грому.","Mam przepis Hildy. Trzeba go zanieść do Groma.","","False","topic_cookery_hildaget","",""
"Scripts/Content/Story/Log_Entries/LOG_Constants_Notes.d:383","За рецепт маринованых грибов Гром дал мне полсотни стрел.","Za przepis na marynowane grzyby, od Groma dostałem pięćdziesiąt strzał.","","False","topic_cookery_hildagiven","",""
"Scripts/Content/Story/Log_Entries/LOG_Constants_Notes.d:384","Рецепт Хильды утрачен для мира.","Przepis Hildy został na zawsze utracony.","","False","topic_cookery_hildadead","",""
"Scripts/Content/Story/Log_Entries/LOG_Constants_Notes.d:386","Больше рецептов мне не найти.","Nie zdołam znaleźć więcej przepisów.","","False","topic_cookery_success","",""
"Scripts/Content/Story/Log_Entries/LOG_Constants_Notes.d:387","Рецепты Грому больше не нужны. Покойся с миром.","Grom już nie potrzebuje żadnych przepisów. Niech spoczywa w spokoju.","","False","topic_cookery_fail_gromdead","",""
"Scripts/Content/Story/Log_Entries/LOG_Constants_Notes.d:390","Плотник на мели","Spłukany stolarz","","False","topic_thorbensales","",""
"Scripts/Content/Story/Log_Entries/LOG_Constants_Notes.d:391","Плотник Торбен никак не может продать изготовленную мебель. Возможно, я смогу найти покупателей. У него есть готовый стол, стулья, комоды, шкаф и сундуки.","Stolarz Thorben nie może sprzedać mebli, które zrobił. Może znajdę kupców. Ma stół, krzesła, szafę oraz komody i kufry.","","False","topic_thorbensales_start","",""
"Scripts/Content/Story/Log_Entries/LOG_Constants_Notes.d:394","Как вернуть мужа домой","Jak sprowadzić męża do domu","","False","topic_fellangohome","",""
"Scripts/Content/Story/Log_Entries/LOG_Constants_Notes.d:395","Ирина никак не может вернуть мужа домой. Феллан ушел из дому и поселился прямо на причале с твердым намерением уплыть с острова. Говорят, он всегда был странным, а теперь окончательно тронулся умом.","Irena nie ma jak sprowadzić męża do domu. Fellan opuścił dom i usadowił się na nabrzeżu ze stanowczym zamiarem opuszczenia wyspy. Podobno zawsze był dziwny, ale teraz chyba zupełnie postradał zmysły.","","False","topic_fellangohome_start","",""
"Scripts/Content/Story/Log_Entries/LOG_Constants_Notes.d:396","Уговоры на Феллана не действуют, он ведет себя как окончательно спятивший. Нужно придумать какую-то уловку. Посоветуюсь с Ириной, она все-таки его жена.","Perswazja nie działa na Fellana, zachowuje się jak zupełny szaleniec. Trzeba wymyślić jakiś podstęp. Skonsultuję się z Ireną, w końcu jest jego żoną.","","False","topic_fellangohome_talkfail","",""
"Scripts/Content/Story/Log_Entries/LOG_Constants_Notes.d:397","Ирина рассказала, что Феллан был очень привязан к разным старым вещам, а особенно - к молотку своего деда. Молоток лежит в сундуке Феллана вместе с остальным хламом.","Irena powiedziała, że Fellan był bardzo przywiązany do różnych starych rzeczy, a zwłaszcza do młotka swojego dziadka. Młotek jest w kufrze Fellana razem z resztą rupieci.","","False","topic_fellangohome_hammertold","",""
"Scripts/Content/Story/Log_Entries/LOG_Constants_Notes.d:398","Молоток у меня. Увы, рукоятка сломана посередине. Нужно его починить, да так, чтобы стал как новенький.","Mam młotek. Niestety, rękojeść jest uszkodzona. Trzeba go naprawić i sprawić, aby wyglądał jak nowy.","","False","topic_fellangohome_hammerbroken","",""
"Scripts/Content/Story/Log_Entries/LOG_Constants_Notes.d:399","Кузнец Карл из Портового квартала должен суметь починить молоток.","Carl, kowal z Dzielnicy Portowej, powinien być w stanie naprawić młotek.","","False","topic_fellangohome_hammersmith","",""
"Scripts/Content/Story/Log_Entries/LOG_Constants_Notes.d:400","Карл может починить молоток, но у него нет точно такой же древесины для рукоятки. Нужно поговорить с плотником Торбеном.","Carl może naprawić młotek, ale nie ma dokładnie takiego samego drewna na trzonek. Trzeba porozmawiać ze stolarzem Thorbenem.","","False","topic_fellangohome_hammercarl","",""
"Scripts/Content/Story/Log_Entries/LOG_Constants_Notes.d:401","Торбен уверяет, что рукоятка сделана из тиса. К несчастью, тис уже давно не растет на Хоринисе и у Торбена его нет. Из тиса делают луки, а еще его называют негной-дерево, потому что он не портится в воде.","Thorben zapewnia mnie, że uchwyt młotka został wykonany z cisu. Niestety, cis od dawna nie rośnie na Khorinis, a Thorben go nie ma. Cis jest używany do produkcji łuków i jest również znany jako niebutwiejące drewno, ponieważ nie psuje się w kontakcie z wodą.","","False","topic_fellangohome_hammerthorben","",""
"Scripts/Content/Story/Log_Entries/LOG_Constants_Notes.d:402","У Боспера нет древесины тиса, а если бы и была, то не подошла бы для рукояти - луки изготавливают из другой части. Он посоветовал поспрашивать в порту - из тиса иногда делают сваи и лодки.","Bosper nie miał drewna cisu, a nawet gdyby miał, nie nadawałoby się na rękojeść - łuki wykonuje się z innej części. Zasugerował, aby popytać w porcie - cis jest czasem używany do produkcji pali i łodzi.","","False","topic_fellangohome_hammerbosper","",""
"Scripts/Content/Story/Log_Entries/LOG_Constants_Notes.d:403","Нужно спросить Фабио и Бруно, у рабочих на верфи.","Trzeba będzie zapytać Fabio i Bruno, pracowników w porcie.","","False","topic_fellangohome_hammerhafenasked","",""
"Scripts/Content/Story/Log_Entries/LOG_Constants_Notes.d:404","У работников в Порту есть небольшой запас тиса. Я могу купить чурбак за 50 золотых.","Robotnicy w porcie mają niewielki zapas cisu. Mogę kupić odpowiedniej długości klocek za 50 sztuk złota.","","False","topic_fellangohome_hammerhafen","",""
"Scripts/Content/Story/Log_Entries/LOG_Constants_Notes.d:405","Теперь у меня есть древесина для рукоятки.","Mam drewno na rękojeść młotka.","","False","topic_fellangohome_hammeryew","",""
"Scripts/Content/Story/Log_Entries/LOG_Constants_Notes.d:406","Готово! Молоток как новенький.","Gotowe! Młotek jest jak nowy.","","False","topic_fellangohome_hammerrepaired","",""
"Scripts/Content/Story/Log_Entries/LOG_Constants_Notes.d:407","Феллан не поддался на уловку с молотком, хотя и заколебался. Кажется, я что-то упускаю...","Fellan nie dał się nabrać na sztuczkę z młotkiem, choć się zawahał. Chyba coś zostało przeoczone...","","False","topic_fellangohome_hammerfail","",""
"Scripts/Content/Story/Log_Entries/LOG_Constants_Notes.d:408","Ирина вспомнила кое-что интересное. Дед Феллана любил повторять, что старые вещи, как и отношения между людьми, нужно всегда чинить, а не выбрасывать. Феллан всегда старался следовать наказу деда. Думаю, теперь я знаю, как его уговорить.","Irena przypomniała sobie coś ciekawego. Dziadek Fellana lubił powtarzać, że stare rzeczy, takie jak relacje między ludźmi, należy zawsze naprawiać, a nie wyrzucać. Fellan zawsze starał się postępować zgodnie z zasadą dziadka. Myślę, że teraz wiem, jak go przekonać.","","False","topic_fellangohome_clue","",""
"Scripts/Content/Story/Log_Entries/LOG_Constants_Notes.d:409","Сработало! Феллан вернулся домой. Надо будет проведать Ирину.","Udało się! Fellan wrócił do domu. Trzeba sprawdzić co u Ireny.","","False","topic_fellangohome_success","",""
"Scripts/Content/Story/Log_Entries/LOG_Constants_Notes.d:410","Ирина выглядит очень счастливой.","Irena wygląda na bardzo szczęśliwą.","","False","topic_fellangohome_successirene","",""
"Scripts/Content/Story/Log_Entries/LOG_Constants_Notes.d:411"," Она подарила мне амулет на удачу, который Феллан починил первым делом.","Dała mi amulet szczęścia, który Fellan od razu naprawił.","","False","topic_fellangohome_successamul","",""
"Scripts/Content/Story/Log_Entries/LOG_Constants_Notes.d:412","Феллан умер. Ирина с ума сойдет от горя. Не смогу ей сказать.","Fellan nie żyje. Irena oszaleje z rozpaczy. Nie mogę jej o tym powiedzieć.","","False","topic_fellangohome_fail_deadfellan","",""
"Scripts/Content/Story/Log_Entries/LOG_Constants_Notes.d:413","Ирина погибла. Интересно, Феллан хотя бы заметит?","Irena nie żyje. Zastanawiam się, czy Fellan w ogóle to zauważy.","","False","topic_fellangohome_fail_deadirene","",""
"Scripts/Content/Story/Log_Entries/LOG_Constants_Notes.d:414","Ну и как теперь починить молоток?","No i jak teraz naprawić młotek?","","False","topic_fellangohome_fail_hummer","",""
"Scripts/Content/Story/Log_Entries/LOG_Constants_Notes.d:418","А где Трокар?","Gdzie jest Trokar?","","False","topic_findtrocar","",""
"Scripts/Content/Story/Log_Entries/LOG_Constants_Notes.d:419","Барток, ученик Боспера, попросил найти своего друга, Трокара, и передать ему, что он забыл свой нож на стойке у Орлана. Трокар уже несколько дней охотится где-то один. ","Bartok, czeladnik Bospera, poprosił o odnalezienie swojego przyjaciela, Trokara, i powiedzenie mu, że zapomniał swojego noża na stojaku u Orlana. Trokar od kilku dni gdzieś samotnie poluje.","","False","topic_findtrocar_start","",""
"Scripts/Content/Story/Log_Entries/LOG_Constants_Notes.d:420","Трокар забрался в самую дальнюю часть острова в погоне за раненым секачом. Это же надо было - три дня идти по следу и выжидать его, сидя на дереве!","Trokar udał się do najdalszej części wyspy w pogoni za rannym siekaczem. Więc przez trzy dni trzeba było podążać po śladach i czekać na niego, siedząc na drzewie!","","False","topic_findtrocar_found","",""
"Scripts/Content/Story/Log_Entries/LOG_Constants_Notes.d:421","Я сказал Трокару про нож.","Powiedziałem Trokarowi o nożu.","","False","topic_findtrocar_told","",""
"Scripts/Content/Story/Log_Entries/LOG_Constants_Notes.d:422","Я сказала Трокару про нож.","Powiedziałam Trokarowi o nożu.","","False","topic_findtrocar_told_f","",""
"Scripts/Content/Story/Log_Entries/LOG_Constants_Notes.d:423","Нож Трокару больше не понадобится...","Nóż Trokarowi już nie będzie potrzebny...","","False","topic_findtrocar_faildead","",""
"Scripts/Content/Story/Log_Entries/LOG_Constants_Notes.d:428","Свободное время","Czas wolny","","False","topic_freetime","",""
"Scripts/Content/Story/Log_Entries/LOG_Constants_Notes.d:429","Конкурс Константино завершен, но жизнь продолжается! Вы вольны оставаться на осеннем Хоринисе сколько душе угодно.","Konkurs Constantino dobiegł końca, ale życie toczy się dalej! Możesz pozostać na jesiennym Khorinis tak długo, ile zechcesz.","","False","topic_freetime_start","",""
"Scripts/Content/Story/Log_Entries/LOG_Constants_Notes.d:431","Торговля","Handel","","False","topic_trader","",""
"Scripts/Content/Story/Log_Entries/LOG_Constants_Notes.d:432","Боспер продает луки и покупает шкуры.","Bosper sprzedaje łuki i skupuje skóry.","","False","topic_trader_bosper","",""
"Scripts/Content/Story/Log_Entries/LOG_Constants_Notes.d:433","В таверне “Мертвая гарпия“ можно купить еду и другие полезные товары.","W gospodzie Pod Martwą Harpią można kupić prowiant i inne przydatne przedmioty.","","False","topic_trader_orlan","",""
"Scripts/Content/Story/Log_Entries/LOG_Constants_Notes.d:434","Саландрил из Верхнего квартала продает зелья и травы.","Salandril z Górnego Miasta sprzedaje mikstury i zioła.","","False","topic_trader_salandril","",""
"Scripts/Content/Story/Log_Entries/LOG_Constants_Notes.d:435","Бальтрам продает продукты на рыночной площади.","Balthram sprzedaje produkty spożywcze na Placu Targowym.","","False","topic_trader_baltram","",""
"Scripts/Content/Story/Log_Entries/LOG_Constants_Notes.d:436","Зурис с рыночной площади продает лечебные зелья и травы.","Zuris z Placu Targowego sprzedaje mikstury lecznicze i zioła.","","False","topic_trader_zuris","",""
