"location","source","target","id","fuzzy","context","translator_comments","developer_comments"
"Scripts/Content/Story/Log_Entries/LOG_Constants_Notes.d:122","Волки больше не угрожают Крестику.","","","False","topic_till_pet_wolfsdead","",""
"Scripts/Content/Story/Log_Entries/LOG_Constants_Notes.d:123","Что такое? Крестик вдруг убежал от меня. Наверное, он вернулся домой, на кладбище.","","","False","topic_till_pet_runaway","",""
"Scripts/Content/Story/Log_Entries/LOG_Constants_Notes.d:124","Надо бы проверить, как там Крестик.","","","False","topic_till_pet_checkout","",""
"Scripts/Content/Story/Log_Entries/LOG_Constants_Notes.d:125","Крестика нет на месте! Он никогда раньше не убегал. Надо поискать его, он не мог далеко уйти!","","","False","topic_till_pet_lost","",""
"Scripts/Content/Story/Log_Entries/LOG_Constants_Notes.d:126","Крестик куда-то убежал! Он никогда раньше так не делал. Надо поискать его, он не мог далеко уйти!","","","False","topic_till_pet_lost2","",""
"Scripts/Content/Story/Log_Entries/LOG_Constants_Notes.d:127","Вот те раз! Крестик оказался девочкой. И похоже, скоро у меня будет много новых питомцев...","","","False","topic_till_pet_female","",""
"Scripts/Content/Story/Log_Entries/LOG_Constants_Notes.d:128","Думаю, Крестику лучше остаться у Сагитты. Я еще не готов стать отцом!","","","False","topic_till_pet_sagittastay","",""
"Scripts/Content/Story/Log_Entries/LOG_Constants_Notes.d:129","Нужно найти место, где Крестик могла бы принести потомство. Пещера позади дома Онара подошла бы, но там полно гоблинов. И еще надо постелить солому - возьму один тюк из нашего амбара.","","","False","topic_till_pet_birthplace","",""
"Scripts/Content/Story/Log_Entries/LOG_Constants_Notes.d:130","Отвар из горичая отпугивает гоблинов. Мне нужно найти хотя бы 3 цветка в долине в горах за фермой Лобарта, тогда Сагитта приготовит отвар.","","","False","topic_till_pet_burntea","",""
"Scripts/Content/Story/Log_Entries/LOG_Constants_Notes.d:131","Сагитта приготовила отвар. Надо разбрызгать в пещере.","","","False","topic_till_pet_burnteagot","",""
"Scripts/Content/Story/Log_Entries/LOG_Constants_Notes.d:132","Теперь пещера свободна от гоблинов.","","","False","topic_till_pet_gobboremoved","",""
"Scripts/Content/Story/Log_Entries/LOG_Constants_Notes.d:133","Все готово. Надо привести Крестика.","","","False","topic_till_pet_caveready","",""
"Scripts/Content/Story/Log_Entries/LOG_Constants_Notes.d:134","Кажется, ей понравилась пещера. Теперь осталось только ждать.","","","False","topic_till_pet_transferred","",""
"Scripts/Content/Story/Log_Entries/LOG_Constants_Notes.d:135","Да! Это случилось! Три малюсеньких кротокрысика появились на свет. Как же мне их назвать?..","","","False","topic_till_pet_born","",""
"Scripts/Content/Story/Log_Entries/LOG_Constants_Notes.d:136","Крестик погиб... Я всегда буду помнить тебя, малыш!","","","False","topic_till_pet_fail","",""
"Scripts/Content/Story/Log_Entries/LOG_Constants_Notes.d:140","Охотник за древностями","","","False","topic_erol_plates","",""
"Scripts/Content/Story/Log_Entries/LOG_Constants_Notes.d:141","Маг Ватрас хочет получить как можно больше древних каменных табличек и других артефактов для изучения.","","","False","topic_erol_plates_start","",""
"Scripts/Content/Story/Log_Entries/LOG_Constants_Notes.d:143","На одной из табличек Ватрас нашел упоминание об амулете Ищущего огонька и попросил меня отправиться на поиски.","","","False","topic_erol_plates_amul","",""
"Scripts/Content/Story/Log_Entries/LOG_Constants_Notes.d:144","Искать амулет лучше там, где собираются блуждающие огоньки. Думаю, имеет смысл осмотреть горы вокруг руин.","","","False","topic_erol_plates_amulwhere","",""
"Scripts/Content/Story/Log_Entries/LOG_Constants_Notes.d:145","Я нашел амулет на дне озера в горах.","","","False","topic_erol_plates_amulfound","",""
"Scripts/Content/Story/Log_Entries/LOG_Constants_Notes.d:146","Я надел амулет, но огонек не появился.","","","False","topic_erol_plates_amulwearself","",""
"Scripts/Content/Story/Log_Entries/LOG_Constants_Notes.d:147","Ватрас надел амулет, но огонек не появился.","","","False","topic_erol_plates_amulwearvatras","",""
"Scripts/Content/Story/Log_Entries/LOG_Constants_Notes.d:148","Я отдал амулет Ватрасу. Он попросил зайти к нему завтра.","","","False","topic_erol_plates_amulgiven","",""
"Scripts/Content/Story/Log_Entries/LOG_Constants_Notes.d:149","Ватрас попросил зарядить амулет. Для этого нужно сначала найти кусок магической руды. Затем прийти в круг камней, приложить руду к амулету и прочесть заклинание. В конце необходимо убить блуждающий огонек, тогда огонек из амулета должен возродиться.","","","False","topic_erol_plates_amulcharge","",""
"Scripts/Content/Story/Log_Entries/LOG_Constants_Notes.d:150","Я зарядил амулет. Надеюсь, сработало.","","","False","topic_erol_plates_amulcharged","",""
"Scripts/Content/Story/Log_Entries/LOG_Constants_Notes.d:151","Я рассеял блуждающий огонек. Теперь амулет должен работать.","","","False","topic_erol_plates_amulwispkilled","",""
"Scripts/Content/Story/Log_Entries/LOG_Constants_Notes.d:152","Огонек появляется, но ничего не ищет.","","","False","topic_erol_plates_amulworks","",""
"Scripts/Content/Story/Log_Entries/LOG_Constants_Notes.d:153","Оказывается, огонек еще нужно обучить поиску. Я оставил амулет Ватрасу.","","","False","topic_erol_plates_amulsuccess","",""
"Scripts/Content/Story/Log_Entries/LOG_Constants_Notes.d:155","Ватрас попросил помочь ему расшифровать числа на древнем языке. Он дал мне глиняную табличку с двумя столбцами чисел. Числа отелены линиями, а число над двойной чертой равно сумме чисел под ней.","","","False","topic_erol_plates_numbers","",""
"Scripts/Content/Story/Log_Entries/LOG_Constants_Notes.d:156","На обратной стороне таблички есть еще какие-то пометки, но они слишком бледные. Если втереть в них уголь, то будет лучше видно.","","","False","topic_erol_plates_numbersback","",""
"Scripts/Content/Story/Log_Entries/LOG_Constants_Notes.d:157","Выпишу на отдельном листе, чему равна каждая цифра.","","","False","topic_erol_plates_numberswrite","",""
"Scripts/Content/Story/Log_Entries/LOG_Constants_Notes.d:158","Эврика! Я нашел решение. Нужно показать Ватрасу.","","","False","topic_erol_plates_numberssolved","",""
"Scripts/Content/Story/Log_Entries/LOG_Constants_Notes.d:159","Кажется, Ватрас был уверен, что я смогу решить задачку с числами.","","","False","topic_erol_plates_numberstold","",""
"Scripts/Content/Story/Log_Entries/LOG_Constants_Notes.d:161","Я нашел золотую табличку у одного скелета на кладбище в лесу. Первый раз такую вижу.","","","False","topic_erol_plates_goldfound","",""
"Scripts/Content/Story/Log_Entries/LOG_Constants_Notes.d:162","Ватраса крайне заинтересовала золотая табличка. На ней записи какого-то древнего целителя. Там может быть еще что-то ценное, но придется покопаться в земле. Потребуется кирка, стоит поболтать с кузнецом или поискать по старым шахтам.","","","False","topic_erol_plates_goldgiven","",""
"Scripts/Content/Story/Log_Entries/LOG_Constants_Notes.d:163","Карл готов выковать кирку за 300 золотых.","","","False","topic_erol_plates_smithcarl","",""
"Scripts/Content/Story/Log_Entries/LOG_Constants_Notes.d:164","Я откопал несколько каменных и серебряную табличку. У серебряной отломан угол.","","","False","topic_erol_plates_silverfound","",""
"Scripts/Content/Story/Log_Entries/LOG_Constants_Notes.d:165"," И я не заметил его нигде поблизости. Может, гоблины? Эти мелкие бестии норовят утащить все, что блестит.","","","False","topic_erol_plates_silverfound_broken","",""
"Scripts/Content/Story/Log_Entries/LOG_Constants_Notes.d:166","Отломанный угол серебряной таблички действительно оказался у гоблинов. Нужно отдать Ватрасу.","","","False","topic_erol_plates_silverpiecefound","",""
"Scripts/Content/Story/Log_Entries/LOG_Constants_Notes.d:167","У одного гоблина я нашел обломок серебряной таблички. Интересно, где остальное?","","","False","topic_erol_plates_silverpiecefound_first","",""
"Scripts/Content/Story/Log_Entries/LOG_Constants_Notes.d:168","Ватрас получил серебряную табличку вместе с потеряным куском.","","","False","topic_erol_plates_silvergivenfull","",""
"Scripts/Content/Story/Log_Entries/LOG_Constants_Notes.d:170","Похоже, сейчас я сделал для Ватраса все, что мог. Но если я найду еще таблички, он всегда купит их.","","","False","topic_erol_plates_success","",""
"Scripts/Content/Story/Log_Entries/LOG_Constants_Notes.d:174","Подарочная суматоха","","","False","topic_elena_present","",""
"Scripts/Content/Story/Log_Entries/LOG_Constants_Notes.d:175","У родителей скоро годовщина свадьбы, а я все еще не нашла подарок для них. Нужно обойти торговцев в городе. Наверняка, я смогу выбрать что-нибудь.","","","False","topic_elena_present_start","",""
"Scripts/Content/Story/Log_Entries/LOG_Constants_Notes.d:176","Не думаю, что у торговцев на рыночной площади есть что-то подходящее. Лучше поспрашивать в Нижнем и Верхнем квартале.","","","False","topic_elena_present_market","",""
"Scripts/Content/Story/Log_Entries/LOG_Constants_Notes.d:177","У Маттео ничего подходящего не нашлось. Он посоветовал поговорить с Лютеро из Верхнего квартала.","","","False","topic_elena_present_matteo","",""
"Scripts/Content/Story/Log_Entries/LOG_Constants_Notes.d:179","У торговца Лютеро обнаружился интересный кубок - кубок Верности, символизирующий прочность семейных уз. Увы, но у него только один из пары, и он стоит 350 золотых.","","","False","topic_elena_present_cuplutero","",""
"Scripts/Content/Story/Log_Entries/LOG_Constants_Notes.d:180","Я получила кубок Лютеро.","","","False","topic_elena_present_cupluterogot","",""
"Scripts/Content/Story/Log_Entries/LOG_Constants_Notes.d:181","Лютеро готов обменять шкуру мракориса на свой кубок. Где я ее ему достану? Не каждый охотник пойдет на такую зверюгу.","","","False","topic_elena_present_cupluterofur","",""
"Scripts/Content/Story/Log_Entries/LOG_Constants_Notes.d:183","Второй кубок должен быть у ростовщика Лемара.","","","False","topic_elena_present_lehmar","",""
"Scripts/Content/Story/Log_Entries/LOG_Constants_Notes.d:184","Лемар наотрез отказался продать кубок. Нужно поспрашивать в порту, вдруг мне кто-нибудь поможет.","","","False","topic_elena_present_lehmarno","",""
"Scripts/Content/Story/Log_Entries/LOG_Constants_Notes.d:185","Кардиф посоветовал обратиться к торговцу рыбой Халвору.","","","False","topic_elena_present_kardiftold","",""
"Scripts/Content/Story/Log_Entries/LOG_Constants_Notes.d:186","Халвор согласился достать для меня кубок Лемара за 500 золотых.","","","False","topic_elena_present_halvorasked","",""
"Scripts/Content/Story/Log_Entries/LOG_Constants_Notes.d:187","Я заплатила Халвору. Он велел приходить завтра после заката.","","","False","topic_elena_present_halvorpayed","",""
"Scripts/Content/Story/Log_Entries/LOG_Constants_Notes.d:188","Я наконец-то заполучила кубок Лемара.","","","False","topic_elena_present_cuplehmargot","",""
"Scripts/Content/Story/Log_Entries/LOG_Constants_Notes.d:189","Теперь у меня есть оба кубка Верности. Надеюсь, родителям понравится.","","","False","topic_elena_present_cupsboth","",""
"Scripts/Content/Story/Log_Entries/LOG_Constants_Notes.d:190","Как оказалось, кубок у Лемара просто украли. И еще этот кубок - его последняя память о сбежавшей дочери. ","","","False","topic_elena_present_lehmarcuptheft","",""
"Scripts/Content/Story/Log_Entries/LOG_Constants_Notes.d:191","Ну и что? Теперь он мой.","","","False","topic_elena_present_lehmarcupmine","",""
"Scripts/Content/Story/Log_Entries/LOG_Constants_Notes.d:192","Я пообещала вернуть ему кубок.","","","False","topic_elena_present_lehmarwaits","",""
"Scripts/Content/Story/Log_Entries/LOG_Constants_Notes.d:193","Я вернула ему кубок, найду другой подарок.","","","False","topic_elena_present_lehmarreturned","",""
"Scripts/Content/Story/Log_Entries/LOG_Constants_Notes.d:194","Лемар силой отобрал у меня кубок. Глаза у него были совсем безумные, пусть лучше остается у него.","","","False","topic_elena_present_lehmarcupforced","",""
"Scripts/Content/Story/Log_Entries/LOG_Constants_Notes.d:196","Я получила шкуру мракориса. Ее можно подарить, но сначала лучше хорошо выделать. Стоит наведаться к Босперу.","","","False","topic_elena_present_shadowfurgot","",""
"Scripts/Content/Story/Log_Entries/LOG_Constants_Notes.d:197","Боспер может обработать шкуру за 300 золотых. И ему нужно не меньше 3 дней.","","","False","topic_elena_present_bosperfurprice","",""
"Scripts/Content/Story/Log_Entries/LOG_Constants_Notes.d:198","Боспер приступил к работе. Через 3 дня шкура будет готова.","","","False","topic_elena_present_bosperworks","",""
"Scripts/Content/Story/Log_Entries/LOG_Constants_Notes.d:199","Выделанная шкура мракориса просто великолепна. Она отлично будет смотреться в спальне родителей.","","","False","topic_elena_present_furready","",""
"Scripts/Content/Story/Log_Entries/LOG_Constants_Notes.d:201","Брайан, ученик кузнеца, сказал, что может выковать два кольца с портретами родителей, чтобы они всегда могли видеть друг друга. Ему нужно золото и сами портреты.","","","False","topic_elena_present_brian","",""
"Scripts/Content/Story/Log_Entries/LOG_Constants_Notes.d:202","Брайан просит за работу 150 золотых. Деньги можно отдать, когда кольца будут готовы.","","","False","topic_elena_present_brianprice","",""
"Scripts/Content/Story/Log_Entries/LOG_Constants_Notes.d:203","Брайан приступил к работе. Он не уверен, сколько ему потребуется времени, но точно не меньше 2 дней.","","","False","topic_elena_present_brianstart","",""
"Scripts/Content/Story/Log_Entries/LOG_Constants_Notes.d:204","Кольца готовы. Я могу забрать их, заплатив Брайану за работу 150 золотых.","","","False","topic_elena_present_ringsready","",""
"Scripts/Content/Story/Log_Entries/LOG_Constants_Notes.d:205","Кольца у меня. Осталось вставить в них портерты.","","","False","topic_elena_present_ringsgot","",""
"Scripts/Content/Story/Log_Entries/LOG_Constants_Notes.d:206","Мне не понравилась работа Брайана, и он переплавил кольца обратно. Нужно найти другой подарок.","","","False","topic_elena_present_ringsreturned","",""
"Scripts/Content/Story/Log_Entries/LOG_Constants_Notes.d:207","Мне нужно чистое золото, лучше всего два золотых кольца, которые Брайан сможет перековать.","","","False","topic_elena_present_neededmaterials","",""
"Scripts/Content/Story/Log_Entries/LOG_Constants_Notes.d:208","Картограф Ибрагим может сделать копии портретов нужного размера. Нужно принести ему оригинал. Я точно видела где-то портрет родителей в молодости, но где? Надо у Василия спросить, только чтобы отец не слышал.","","","False","topic_elena_present_knowsbrahim","",""
"Scripts/Content/Story/Log_Entries/LOG_Constants_Notes.d:209","Ибрагим приступил к работе. Портреты должны быть готовы через 3 часа.","","","False","topic_elena_present_brahimworks","",""
"Scripts/Content/Story/Log_Entries/LOG_Constants_Notes.d:210","Портреты готовы. Ибрагим настоящий художник. Осталось вставить их в кольца. Это должно быть просто. И не забыть вернуть старый портрет домой!","","","False","topic_elena_present_portretsready","",""
"Scripts/Content/Story/Log_Entries/LOG_Constants_Notes.d:211","Готово! Портреты идеально подошли к кольцам.","","","False","topic_elena_present_portretsinserted","",""
"Scripts/Content/Story/Log_Entries/LOG_Constants_Notes.d:213"," Это был бы хороший подарок. Но, возможно, я смогу найти и другой.","","","False","topic_elena_present_add1","",""
"Scripts/Content/Story/Log_Entries/LOG_Constants_Notes.d:214"," Еще один вариант подарка. Стоит ли искать третий?","","","False","topic_elena_present_add2","",""
"Scripts/Content/Story/Log_Entries/LOG_Constants_Notes.d:215"," Я нашла три разных подарка для родителей. Надо уже определяться, что именно я подарю.","","","False","topic_elena_present_add3","",""
"Scripts/Content/Story/Log_Entries/LOG_Constants_Notes.d:218","Грибной супчик","","","False","topic_elena_theklasoup","",""
"Scripts/Content/Story/Log_Entries/LOG_Constants_Notes.d:219","Текла попросила собрать десяток красных болтунов, чтобы она могла сварить грибной суп.","","","False","topic_elena_theklasoup_needredmr","",""
"Scripts/Content/Story/Log_Entries/LOG_Constants_Notes.d:220","Я принесла Текле грибы. Завтра на обед будет грибной супчик.","","","False","topic_elena_theklasoup_mrgiven","",""
"Scripts/Content/Story/Log_Entries/LOG_Constants_Notes.d:221","Супчик Теклы просто бесподобен!","","","False","topic_elena_theklasoup_gotsoup","",""
"Scripts/Content/Story/Log_Entries/LOG_Constants_Notes.d:222","Никогда мне больше не попробовать супчик Теклы! И похлебку, и пирожки, и... (дальше чернила размазаны слезами)","","","False","topic_elena_theklasoup_faildead","",""
"Scripts/Content/Story/Log_Entries/LOG_Constants_Notes.d:225","Старые друзья и новые заботы","","","False","topic_sarah_oldfriends","",""
"Scripts/Content/Story/Log_Entries/LOG_Constants_Notes.d:226","Ханна права - я слишком зациклилась на этом дурацком рынке. И я совсем забыла о своих старых друзьях. Я так давно не спускалась в портовый квартал и даже не знаю, как у них дела. Надо навестить всех.","","","False","topic_sarah_oldfriends_start","",""
"Scripts/Content/Story/Log_Entries/LOG_Constants_Notes.d:227","Эдда в порядке. И все также варит вкуснейший рыбный суп.","","","False","topic_sarah_oldfriends_edda","",""
"Scripts/Content/Story/Log_Entries/LOG_Constants_Notes.d:228","Эдда погибла! А она была мне как мать.","","","False","topic_sarah_oldfriends_eddadead","",""
"Scripts/Content/Story/Log_Entries/LOG_Constants_Notes.d:229","Феня сетует, что рыбаки давно не приносили свежей рыбы. А покупатели жалуются.","","","False","topic_sarah_oldfriends_fenia","",""
"Scripts/Content/Story/Log_Entries/LOG_Constants_Notes.d:230","Фени не стало. Да успокоит Аданос ее душу!","","","False","topic_sarah_oldfriends_feniadead","",""
"Scripts/Content/Story/Log_Entries/LOG_Constants_Notes.d:231","Кардиф как всегда готов выложить все новости за пару золотых.","","","False","topic_sarah_oldfriends_kardif","",""
"Scripts/Content/Story/Log_Entries/LOG_Constants_Notes.d:232","Кардиф умер. Без его пива и баек Порт будет уже не тот.","","","False","topic_sarah_oldfriends_kardifdead","",""
"Scripts/Content/Story/Log_Entries/LOG_Constants_Notes.d:233","Мо опять стоит в дверях у Кардифа. Сколько его помню, он всегда был здоров подраться, но никогда не поднимал руку на женщин.","","","False","topic_sarah_oldfriends_moe","",""
"Scripts/Content/Story/Log_Entries/LOG_Constants_Notes.d:234","Умер Мо. Вот уж не думала, что его что-то или кто-то сможет укокошить. Покойся с миром.","","","False","topic_sarah_oldfriends_moedead","",""
"Scripts/Content/Story/Log_Entries/LOG_Constants_Notes.d:235","Похоже, у Нади проблемы. При ее... профессии это неудивительно, но я не думала, что все так плохо. Она выглядит так, будто уже одной ногой стоит в могиле. Надо выяснить, что с ней происходит.","","","False","topic_sarah_oldfriends_nadja","",""
"Scripts/Content/Story/Log_Entries/LOG_Constants_Notes.d:236","Умерла моя лучшая подруга детства, Надя. Наши пути давно разошлись, но я часто вспоминала детские игры. Да смилостивится Белиар над ее душой!","","","False","topic_sarah_oldfriends_nadjadead","",""
