"location","source","target","id","fuzzy","context","translator_comments","developer_comments"
"Scripts/Content/Story/Log_Entries/LOG_Constants_Notes.d:179","У торговца Лютеро обнаружился интересный кубок - кубок Верности, символизирующий прочность семейных уз. Увы, но у него только один из пары, и он стоит 350 золотых.","Kupiec Lutero posiada interesującą rzecz - Puchar Wierności, symbolizujący siłę więzi rodzinnych. Niestety, ma tylko jeden egzemplarz, który kosztuje 350 sztuk złota.","","False","topic_elena_present_cuplutero","",""
"Scripts/Content/Story/Log_Entries/LOG_Constants_Notes.d:180","Я получила кубок Лютеро.","Otrzymałam puchar od Lutero.","","False","topic_elena_present_cupluterogot","",""
"Scripts/Content/Story/Log_Entries/LOG_Constants_Notes.d:181","Лютеро готов обменять шкуру мракориса на свой кубок. Где я ее ему достану? Не каждый охотник пойдет на такую зверюгу.","Lutero jest gotów wymienić puchar za skórę cieniostwora. Skąd miałabym ją wziąć? Nie każdy myśliwy chciałby upolować taką bestię.","","False","topic_elena_present_cupluterofur","",""
"Scripts/Content/Story/Log_Entries/LOG_Constants_Notes.d:183","Второй кубок должен быть у ростовщика Лемара.","Drugi puchar powinien być u lichwiarza Lehmara.","","False","topic_elena_present_lehmar","",""
"Scripts/Content/Story/Log_Entries/LOG_Constants_Notes.d:184","Лемар наотрез отказался продать кубок. Нужно поспрашивать в порту, вдруг мне кто-нибудь поможет.","Lehmar stanowczo odmówił mi sprzedaży pucharu. Muszę popytać w porcie, a nuż ktoś mi w tej sprawie pomoże.","","False","topic_elena_present_lehmarno","",""
"Scripts/Content/Story/Log_Entries/LOG_Constants_Notes.d:185","Кардиф посоветовал обратиться к торговцу рыбой Халвору.","Kardif radzi udać się do sprzedawcy ryb Halvora.","","False","topic_elena_present_kardiftold","",""
"Scripts/Content/Story/Log_Entries/LOG_Constants_Notes.d:186","Халвор согласился достать для меня кубок Лемара за 500 золотых.","Za 500 sztuk złota Halvor zgodził się zdobyć dla mnie puchar od Lehmara.","","False","topic_elena_present_halvorasked","",""
"Scripts/Content/Story/Log_Entries/LOG_Constants_Notes.d:187","Я заплатила Халвору. Он велел приходить завтра после заката.","Zapłaciłam Halvorowi. Powiedział, żebym wróciła jutro po zachodzie słońca.","","False","topic_elena_present_halvorpayed","",""
"Scripts/Content/Story/Log_Entries/LOG_Constants_Notes.d:188","Я наконец-то заполучила кубок Лемара.","W końcu mam w swoich rękach puchar od Lehmara.","","False","topic_elena_present_cuplehmargot","",""
"Scripts/Content/Story/Log_Entries/LOG_Constants_Notes.d:189","Теперь у меня есть оба кубка Верности. Надеюсь, родителям понравится.","Mam teraz oba Puchary Wierności. Mam nadzieję, że spodobają się moim rodzicom.","","False","topic_elena_present_cupsboth","",""
"Scripts/Content/Story/Log_Entries/LOG_Constants_Notes.d:190","Как оказалось, кубок у Лемара просто украли. И еще этот кубок - его последняя память о сбежавшей дочери. ","Jak się okazuje, puchar został po prostu skradziony Lehmarowi. To była też jego ostatnia pamiątka po córce, która uciekła z domu.","","False","topic_elena_present_lehmarcuptheft","",""
"Scripts/Content/Story/Log_Entries/LOG_Constants_Notes.d:191","Ну и что? Теперь он мой.","I co z tego? Teraz jest mój.","","False","topic_elena_present_lehmarcupmine","",""
"Scripts/Content/Story/Log_Entries/LOG_Constants_Notes.d:192","Я пообещала вернуть ему кубок.","Postanowiłam oddać mu puchar.","","False","topic_elena_present_lehmarwaits","",""
"Scripts/Content/Story/Log_Entries/LOG_Constants_Notes.d:193","Я вернула ему кубок, найду другой подарок.","Oddałam puchar Lehmarowi, znajdę sobie inny upominek.","","False","topic_elena_present_lehmarreturned","",""
"Scripts/Content/Story/Log_Entries/LOG_Constants_Notes.d:194","Лемар силой отобрал у меня кубок. Глаза у него были совсем безумные, пусть лучше остается у него.","Lehmar siłą odebrał mi puchar. W jego oczach widać było szaleństwo, więc lepiej, żeby go zatrzymał.","","False","topic_elena_present_lehmarcupforced","",""
"Scripts/Content/Story/Log_Entries/LOG_Constants_Notes.d:196","Я получила шкуру мракориса. Ее можно подарить, но сначала лучше хорошо выделать. Стоит наведаться к Босперу.","Mam skórę cieniostwora. Można ją dać w prezencie, ale lepiej ją najpierw dobrze wyprawić. Warto odwiedzić Bospera.","","False","topic_elena_present_shadowfurgot","",""
"Scripts/Content/Story/Log_Entries/LOG_Constants_Notes.d:197","Боспер может обработать шкуру за 300 золотых. И ему нужно не меньше 3 дней.","Bosper może wyprawić skórę za 300 sztuk złota. Potrzebuje na to co najmniej trzech dni.","","False","topic_elena_present_bosperfurprice","",""
"Scripts/Content/Story/Log_Entries/LOG_Constants_Notes.d:198","Боспер приступил к работе. Через 3 дня шкура будет готова.","Bosper zabrał się do pracy. Za trzy dni skóra będzie gotowa.","","False","topic_elena_present_bosperworks","",""
"Scripts/Content/Story/Log_Entries/LOG_Constants_Notes.d:199","Выделанная шкура мракориса просто великолепна. Она отлично будет смотреться в спальне родителей.","Wyprawiona skóra cieniostwora wygląda wspaniale. Będzie świetnie prezentowała się w sypialni moich rodziców.","","False","topic_elena_present_furready","",""
"Scripts/Content/Story/Log_Entries/LOG_Constants_Notes.d:201","Брайан, ученик кузнеца, сказал, что может выковать два кольца с портретами родителей, чтобы они всегда могли видеть друг друга. Ему нужно золото и сами портреты.","Brian, czeladnik kowala powiedział, że może wykuć dwa pierścienie z portretami rodziców, aby zawsze mogli się widzieć. Potrzebuje do tego złota i portretów.","","False","topic_elena_present_brian","",""
"Scripts/Content/Story/Log_Entries/LOG_Constants_Notes.d:202","Брайан просит за работу 150 золотых. Деньги можно отдать, когда кольца будут готовы.","Brian chce 150 sztuk złota za wykonanie zadania. Zapłaty można dokonać, gdy pierścienie będą gotowe.","","False","topic_elena_present_brianprice","",""
"Scripts/Content/Story/Log_Entries/LOG_Constants_Notes.d:203","Брайан приступил к работе. Он не уверен, сколько ему потребуется времени, но точно не меньше 2 дней.","Brian wziął się do pracy. Nie wie dokładnie ile czasu mu to zajmie, ale nie mniej niż dwa dni.","","False","topic_elena_present_brianstart","",""
"Scripts/Content/Story/Log_Entries/LOG_Constants_Notes.d:204","Кольца готовы. Я могу забрать их, заплатив Брайану за работу 150 золотых.","Pierścienie są gotowe. Mogę je odebrać, jeśli zapłacę Brianowi 150 sztuk złota za jego pracę.","","False","topic_elena_present_ringsready","",""
"Scripts/Content/Story/Log_Entries/LOG_Constants_Notes.d:205","Кольца у меня. Осталось вставить в них портерты.","Mam pierścienie. Muszę tylko umieścić w nich portrety.","","False","topic_elena_present_ringsgot","",""
"Scripts/Content/Story/Log_Entries/LOG_Constants_Notes.d:206","Мне не понравилась работа Брайана, и он переплавил кольца обратно. Нужно найти другой подарок.","Nie spodobała mi się praca Briana i z powrotem przetopił pierścienie. Trzeba poszukać innego upominku.","","False","topic_elena_present_ringsreturned","",""
"Scripts/Content/Story/Log_Entries/LOG_Constants_Notes.d:207","Мне нужно чистое золото, лучше всего два золотых кольца, которые Брайан сможет перековать.","Potrzebuję czystego złota, a najlepiej dwóch złotych pierścieni, które Brian będzie mógł przekuć.","","False","topic_elena_present_neededmaterials","",""
"Scripts/Content/Story/Log_Entries/LOG_Constants_Notes.d:208","Картограф Ибрагим может сделать копии портретов нужного размера. Нужно принести ему оригинал. Я точно видела где-то портрет родителей в молодости, но где? Надо у Василия спросить, только чтобы отец не слышал.","Kartograf Brahim może wykonać kopie portretów w odpowiednim rozmiarze. Trzeba mu przynieść oryginał. Jestem pewna, że w młodości widziałam portret moich rodziców, tylko gdzie? Powinnam o to wypytać Wasilija, jednak ojciec tej rozmowy nie powinien usłyszeć.","","False","topic_elena_present_knowsbrahim","",""
"Scripts/Content/Story/Log_Entries/LOG_Constants_Notes.d:209","Ибрагим приступил к работе. Портреты должны быть готовы через 3 часа.","Brahim zabrał się do pracy. Portrety powinny być gotowe za trzy godziny.","","False","topic_elena_present_brahimworks","",""
"Scripts/Content/Story/Log_Entries/LOG_Constants_Notes.d:210","Портреты готовы. Ибрагим настоящий художник. Осталось вставить их в кольца. Это должно быть просто. И не забыть вернуть старый портрет домой!","Portrety są gotowe. Brahim to prawdziwy artysta. Pozostało tylko umieścić je w pierścieniach. To powinno być łatwe. I nie można zapomnieć zabrać starego portretu do domu!","","False","topic_elena_present_portretsready","",""
"Scripts/Content/Story/Log_Entries/LOG_Constants_Notes.d:211","Готово! Портреты идеально подошли к кольцам.","I gotowe! Portrety idealnie pasowały do pierścieni.","","False","topic_elena_present_portretsinserted","",""
"Scripts/Content/Story/Log_Entries/LOG_Constants_Notes.d:213"," Это был бы хороший подарок. Но, возможно, я смогу найти и другой."," To byłby miły upominek. Ale może znajdę inny.","","False","topic_elena_present_add1","",""
"Scripts/Content/Story/Log_Entries/LOG_Constants_Notes.d:214"," Еще один вариант подарка. Стоит ли искать третий?"," Kolejny wariant upominku. Warto szukać trzeciego?","","False","topic_elena_present_add2","",""
"Scripts/Content/Story/Log_Entries/LOG_Constants_Notes.d:215"," Я нашла три разных подарка для родителей. Надо уже определяться, что именно я подарю."," Znalazłam trzy różne upominki dla moich rodziców. Muszę zdecydować, którym ich obdaruję.","","False","topic_elena_present_add3","",""
"Scripts/Content/Story/Log_Entries/LOG_Constants_Notes.d:218","Грибной супчик","Zupa grzybowa","","False","topic_elena_theklasoup","",""
"Scripts/Content/Story/Log_Entries/LOG_Constants_Notes.d:219","Текла попросила собрать десяток красных болтунов, чтобы она могла сварить грибной суп.","Thekla poprosiła o zebranie dziesięciu czerwonych Papli, aby mogła zrobić zupę grzybową.","","False","topic_elena_theklasoup_needredmr","",""
"Scripts/Content/Story/Log_Entries/LOG_Constants_Notes.d:220","Я принесла Текле грибы. Завтра на обед будет грибной супчик.","Przyniosłam Thekli potrzebne grzyby. Jutro na obiad zjemy zupę grzybową.","","False","topic_elena_theklasoup_mrgiven","",""
"Scripts/Content/Story/Log_Entries/LOG_Constants_Notes.d:221","Супчик Теклы просто бесподобен!","Zupa Thekli jest niesamowita!","","False","topic_elena_theklasoup_gotsoup","",""
"Scripts/Content/Story/Log_Entries/LOG_Constants_Notes.d:222","Никогда мне больше не попробовать супчик Теклы! И похлебку, и пирожки, и... (дальше чернила размазаны слезами)","Nigdy więcej nie spróbuję zupy Thekli! Smacznego gulaszu, wspaniałych ciast, i... (dalej atrament rozmazany przez łzy)","","False","topic_elena_theklasoup_faildead","",""
"Scripts/Content/Story/Log_Entries/LOG_Constants_Notes.d:225","Старые друзья и новые заботы","Starzy przyjaciele i nowe troski","","False","topic_sarah_oldfriends","",""
"Scripts/Content/Story/Log_Entries/LOG_Constants_Notes.d:226","Ханна права - я слишком зациклилась на этом дурацком рынке. И я совсем забыла о своих старых друзьях. Я так давно не спускалась в портовый квартал и даже не знаю, как у них дела. Надо навестить всех.","Hanna ma rację - jestem zbyt pochłonięta tym głupim rynkiem. I zupełnie zapomniałam o moich starych przyjaciołach. Tak dawno nie byłam w dzielnicy portowej i nawet nie wiem, co u nich słychać. Powinnam ich wszystkich odwiedzić.","","False","topic_sarah_oldfriends_start","",""
"Scripts/Content/Story/Log_Entries/LOG_Constants_Notes.d:227","Эдда в порядке. И все также варит вкуснейший рыбный суп.","Edda ma się dobrze. I nadal sporządza pyszną zupę rybną.","","False","topic_sarah_oldfriends_edda","",""
"Scripts/Content/Story/Log_Entries/LOG_Constants_Notes.d:228","Эдда погибла! А она была мне как мать.","Edda nie żyje! Była dla mnie jak matka.","","False","topic_sarah_oldfriends_eddadead","",""
"Scripts/Content/Story/Log_Entries/LOG_Constants_Notes.d:229","Феня сетует, что рыбаки давно не приносили свежей рыбы. А покупатели жалуются.","Fenia narzeka, że rybacy od dawna nie dostarczają świeżych ryb. Użalają się też klienci.","","False","topic_sarah_oldfriends_fenia","",""
"Scripts/Content/Story/Log_Entries/LOG_Constants_Notes.d:230","Фени не стало. Да успокоит Аданос ее душу!","Fenia nie żyje. Niech Adanos ma w opiece jej duszę!","","False","topic_sarah_oldfriends_feniadead","",""
"Scripts/Content/Story/Log_Entries/LOG_Constants_Notes.d:231","Кардиф как всегда готов выложить все новости за пару золотых.","Jak zwykle, Kardif za kilka sztuk złota jest gotów przekazać wszystkie nowiny.","","False","topic_sarah_oldfriends_kardif","",""
"Scripts/Content/Story/Log_Entries/LOG_Constants_Notes.d:232","Кардиф умер. Без его пива и баек Порт будет уже не тот.","Kardif nie żyje. Bez jego piwa i opowieści port nie będzie już taki sam.","","False","topic_sarah_oldfriends_kardifdead","",""
"Scripts/Content/Story/Log_Entries/LOG_Constants_Notes.d:233","Мо опять стоит в дверях у Кардифа. Сколько его помню, он всегда был здоров подраться, но никогда не поднимал руку на женщин.","Moe nadal stoi w drzwiach do Kardifa. Odkąd pamiętam, zawsze był skory do bójek, ale nigdy nie podniósł ręki na kobietę.","","False","topic_sarah_oldfriends_moe","",""
"Scripts/Content/Story/Log_Entries/LOG_Constants_Notes.d:234","Умер Мо. Вот уж не думала, что его что-то или кто-то сможет укокошить. Покойся с миром.","Moe nie żyje. Nigdy nie sądziłam, że cokolwiek lub ktokolwiek może go zabić. Niech spoczywa w spokoju.","","False","topic_sarah_oldfriends_moedead","",""
"Scripts/Content/Story/Log_Entries/LOG_Constants_Notes.d:235","Похоже, у Нади проблемы. При ее... профессии это неудивительно, но я не думала, что все так плохо. Она выглядит так, будто уже одной ногой стоит в могиле. Надо выяснить, что с ней происходит.","Wygląda na to, że Nadja ma problemy. W jej profesji... nie jest to zaskakujące, ale nie sądziłam, że jest aż tak źle. Wygląda na to, że jedną nogą jest na tym świecie. Trzeba się dowiedzieć, co się z nią dzieje.","","False","topic_sarah_oldfriends_nadja","",""
"Scripts/Content/Story/Log_Entries/LOG_Constants_Notes.d:236","Умерла моя лучшая подруга детства, Надя. Наши пути давно разошлись, но я часто вспоминала детские игры. Да смилостивится Белиар над ее душой!","Nie żyje Nadja, moja najlepsza przyjaciółka z młodości. Nasze drogi rozeszły się dawno temu, ale często wspominałam zabawy z dzieciństwa. Niech Beliar zlituje się nad jej duszą!","","False","topic_sarah_oldfriends_nadjadead","",""
"Scripts/Content/Story/Log_Entries/LOG_Constants_Notes.d:237","Бедняга Феллан совсем спятил и ушел из дому. Ирина, его жена, не знает, что и делать. Надо ей как-то помочь.","Biedaczysko Fellan, kompletnie oszalał i opuścił dom. Jego żona Irena już nie wie, co robić. Trzeba jakoś jej pomóc.","","False","topic_sarah_oldfriends_fellan","",""
"Scripts/Content/Story/Log_Entries/LOG_Constants_Notes.d:238","Сумасбродный Феллан встретил свой конец. Бедная Ирина!","Obłąkany Fellan nie żyje. Biedna Irena!","","False","topic_sarah_oldfriends_fellandead","",""
"Scripts/Content/Story/Log_Entries/LOG_Constants_Notes.d:239","Ирина погибла. А она была такой молодой!","Irena nie żyje. A była taka młoda!","","False","topic_sarah_oldfriends_irenedead","",""
"Scripts/Content/Story/Log_Entries/LOG_Constants_Notes.d:240","Дела у Ибрагима идут неважно, но он здоров.","Sprawy u Brahima nie układają się dobrze, ale na zdrowie nie narzeka.","","False","topic_sarah_oldfriends_brahim","",""
"Scripts/Content/Story/Log_Entries/LOG_Constants_Notes.d:241","Ибрагима больше нет среди живых. Он был настоящим мастером пера и кисти.","Brahim nie żyje. Był prawdziwym mistrzem pióra i pędzla.","","False","topic_sarah_oldfriends_brahimdead","",""
"Scripts/Content/Story/Log_Entries/LOG_Constants_Notes.d:242","Старик Берни не пережил прошлую зиму... А я даже не знала. Надо бы помолиться за упокой его души.","Staruszek Bernie nie przeżył ostatniej zimy... Nawet tego nie wiedziałam. Trzeba będzie się modlić za spokój jego duszy.","","False","topic_sarah_oldfriends_bernydead","",""
"Scripts/Content/Story/Log_Entries/LOG_Constants_Notes.d:243","Я помолилась Инносу за упокой души Берни. Светлый был старик!","Pomodliłam się do Innosa o spokój duszy Berniego. Był pogodnym staruszkiem!","","False","topic_sarah_oldfriends_bernyprayinnos","",""
"Scripts/Content/Story/Log_Entries/LOG_Constants_Notes.d:244","Я помолилась Аданосу за упокой души Берни. Пусть море примет его!","Pomodliłam się do Adanosa o spokój duszy Berniego. Niech po wieki grają mu morskie fale!","","False","topic_sarah_oldfriends_bernyprayadanos","",""
"Scripts/Content/Story/Log_Entries/LOG_Constants_Notes.d:245","Я помолилась Белиару, Богу Смерти, за упокой души Берни. Пусть будет он счастлив в загробном мире!","O spokój duszy Berniego pomodliłam się do Beliara, boga Ciemności. Niech zazna szczęścia w mrocznych zaświatach!","","False","topic_sarah_oldfriends_bernypraybeliar","",""
"Scripts/Content/Story/Log_Entries/LOG_Constants_Notes.d:246","Я помолилась Белиару, Богу Смерти, за упокой души Берни. Он позволил мне попрощаться с его духом.","O spokój duszy Berniego pomodliłam się do Beliara, boga Ciemności. Pozwolił mi pożegnać się z jego duchem.","","False","topic_sarah_oldfriends_bernypraybeliar2","",""
"Scripts/Content/Story/Log_Entries/LOG_Constants_Notes.d:247","Я встретилась со всеми своими старыми знакомыми. И на душе стало как-то легче.","Spotkałam się ze wszystkimi dawnymi znajomymi. I na duszy poczułam się o wiele lepiej.","","False","topic_sarah_oldfriends_success","",""
"Scripts/Content/Story/Log_Entries/LOG_Constants_Notes.d:248","Никого из моих старых друзей больше нет в живых. Я как будто еще раз осиротела.","Żaden z moich dawnych przyjaciół już nie żyje. To było jak ponowne osierocenie.","","False","topic_sarah_oldfriends_failalldead","",""
"Scripts/Content/Story/Log_Entries/LOG_Constants_Notes.d:251","Вредная привычка","Szkodliwe przyzwyczajenie","","False","topic_sarah_badhabit","",""
"Scripts/Content/Story/Log_Entries/LOG_Constants_Notes.d:252","Оказывается, Надя подсела на болотник. Нужно срочно ее спасать, иначе она долго не протянет!","Okazuje się, że Nadja jest uzależniona od bagiennego ziela. Trzeba ją natychmiast wyrwać z nałogu, inaczej długo nie pociągnie!","","False","topic_sarah_badhabit_start","",""
"Scripts/Content/Story/Log_Entries/LOG_Constants_Notes.d:253","Надя не хочет меня слушать. В детстве мы дружили, но сейчас она на меня злится. Нужно посоветоваться с кем-нибудь. Кто у нас мастер наставлений?","Nadja nie chce mnie słuchać. Byłyśmy przyjaciółkami w dzieciństwie, ale teraz na mnie się złości. Muszę się z kimś skonsultować. Kto jest mistrzem w udzielaniu porad?","","False","topic_sarah_badhabit_nadjanotlisten","",""
"Scripts/Content/Story/Log_Entries/LOG_Constants_Notes.d:254","Мне нужно найти кого-то, кого она уважает. Родителей ее давно нет, да и не стала бы она их слушать. Эдда? В детстве она была нам как родная.","Muszę znaleźć kogoś, kogo ona darzy szacunkiem. Jej rodzice dawno odeszli, a ona nie chciała ich słuchać. Edda? W dzieciństwie była dla nas jak rodzina.","","False","topic_sarah_badhabit_needauthority","",""
"Scripts/Content/Story/Log_Entries/LOG_Constants_Notes.d:255","Ватрас посоветовал поговорить с алхимиками насчет зелья, которое бы очистило тело Нади от отравы. Но одного зелья мало, нужно убедить ее бросить курить.","Vatras poradził porozmawiać z alchemikami o miksturze, która oczyści ciało Nadji z toksyn. Ale jedna mikstura nie wystarczyła, trzeba ją przekonać do rzucenia palenia.","","False","topic_sarah_badhabit_vatraspotion","",""
"Scripts/Content/Story/Log_Entries/LOG_Constants_Notes.d:256","Эдда сказала, что не может повлиять на Надю. О Аданос, ну почему эта девчонка такая твердолобая? С кем еще поговорить? Я готова пойти даже к Бромору, но его она тем более не послушает. Мо? Он вроде неплохой парень и достаточно пробивной. Или был таким.","Edda powiedziała, że nie może wpłynąć na Nadję. O Adanosie, dlaczego ta dziewczyna jest taka uparta? Z kim jeszcze można porozmawiać? Poszłabym nawet do Bromora, ale ona go nie posłucha. Moe? Niezły z niego chłop z charakterkiem. Albo taki był.","","False","topic_sarah_badhabit_eddanohelp","",""
"Scripts/Content/Story/Log_Entries/LOG_Constants_Notes.d:257","Мо пообещал поговорить с Надей, если я принесу ему белого рома. Это катастрофа, я не знаю ни одного торговца, у которого бы он был!","Moe obiecał porozmawiać z Nadją, jeśli przyniosę mu biały rum. To porażka, nie znam żadnego handlarza, który by to miał!","","False","topic_sarah_badhabit_moewilltalk","",""
