"location","source","target","id","fuzzy","context","translator_comments","developer_comments"
"Scripts/Content/Story/Log_Entries/LOG_Constants_Notes.d:258","Похоже, придется иметь дело не только с нелегальной торговлей болотником, но и с контрафактным алкоголем! В открытую, при свете дня, мне его точно никто не продаст.","Wygląda na to, że będę miała do czynienia nie tylko z nielegalnym handlem bagiennym zielem, ale także z podrabianym alkoholem! Przecież oficjalnie nikt mi tego nie sprzeda.","","False","topic_sarah_badhabit_bootleggers","",""
"Scripts/Content/Story/Log_Entries/LOG_Constants_Notes.d:259","Разговор с Мо ничего не дал. Только подтвердил упрямость Нади. Стоп. А если это использовать? Не уговорить, а разозлить. Она ненавидит гадюшник, в котором находится. Надо выяснить, кто ее особенно раздражает. Только потихоньку, чтобы Надя не догадалась, что это моя затея.","Rozmowa z Moe nic nie dała. Potwierdziła tylko upór Nadji. Chwileczkę, a gdyby ten fakt wykorzystać? Nie żeby ją przekonać, ale żeby ją wkurzyć. Nienawidzi tego piekła, w którym jest. Trzeba się dowiedzieć, kto ją szczególnie denerwuje. Tylko delikatnie, aby Nadja nie domyśliła się, że to wyszło z mojej inicjatywy.","","False","topic_sarah_badhabit_moefailed","",""
"Scripts/Content/Story/Log_Entries/LOG_Constants_Notes.d:260","Борка рассказал, что Надя и Люсия практически на ножах. Это то, что нужно! Надо подговорить Люсию поспорить с Надей, что она не сможет бросить курить - из-за своего упрямства Надя ни за что не проспорит.","Borka powiedział mi, że Nadja i Lucia są w ostrym konflikcie. To jest to, czego potrzebujemy! Trzeba namówić Lucię, żeby założyła się z Nadją, że nie zdoła rzucić palenia, a przez swój upór Nadja nie zechce przegrać.","","False","topic_sarah_badhabit_knowlucia","",""
"Scripts/Content/Story/Log_Entries/LOG_Constants_Notes.d:261","Люсия согласилась на участие в моем плане. В награду она хочет ключ Бромора, который спрятан где-то в порту. Это большой стальной ключ с буквой Б на рукоятке. Думаю, поиски лучше начать в районе “Красного фонаря“.","Lucia zgodziła się wziąć udział w moim planie. W nagrodę chce klucz Bromora, który jest ukryty gdzieś w porcie. Jest to duży stalowy klucz z literą B na uchwycie. Myślę, że najlepszym miejscem do rozpoczęcia poszukiwań będzie rejon Czerwonej Latarni.","","False","topic_sarah_badhabit_askedlucia","",""
"Scripts/Content/Story/Log_Entries/LOG_Constants_Notes.d:262","Я отдала ключ Люсии. Она сегодня же поспорит с Надей. А я поговорю с ней завтра.","Oddałam klucz Lucii i ona dziś założy się z Nadją. Porozmawiam z nią jutro.","","False","topic_sarah_badhabit_giveluciakey","",""
"Scripts/Content/Story/Log_Entries/LOG_Constants_Notes.d:263","Наконец-то сработало! Надя бросает курить. Похоже, это будет не так просто. Какое-нибудь очищающее зелье могло бы помочь.","W końcu się udało! Nadja rzuca palenie. Wygląda na to, że nie będzie to takie łatwe. Jakaś mikstura oczyszczająca mogłaby jej w tym pomóc.","","False","topic_sarah_badhabit_itworked","",""
"Scripts/Content/Story/Log_Entries/LOG_Constants_Notes.d:264","Я отдала зелье Наде и наконец-то добилась от нее благодарности. Завтра надо будет ее проведать.","Dałam miksturę Nadji i w końcu doczekałam się podziękowań. Jutro będę musiała sprawdzić, jak się czuje.","","False","topic_sarah_badhabit_potiongotthanks","",""
"Scripts/Content/Story/Log_Entries/LOG_Constants_Notes.d:265","Надя вернула мне деньги за зелье. Это справедливо. Завтра надо будет ее проведать.","Nadja zwróciła mi pieniądze za miksturę. To całkiem uczciwe. Jutro sprawdzę, jak się czuje.","","False","topic_sarah_badhabit_potiongotgold","",""
"Scripts/Content/Story/Log_Entries/LOG_Constants_Notes.d:266","Из-за лекарства Надя начала кашлять кровью. Нельзя же, чтобы вместо лечения оно загнало ее в могилу! Бегом к Саландрилу.","Lek sprawił, że Nadja zaczęła odkrztuszać krwią. Nie możemy pozwolić, by te leczenie wpędziło ją do grobu! Biegiem do Salandrila.","","False","topic_sarah_badhabit_bloodycough","",""
"Scripts/Content/Story/Log_Entries/LOG_Constants_Notes.d:267","Я отдала мазь Наде. Теперь остается только ждать.","Dałam maść Nadji. Teraz pozostaje tylko czekać.","","False","topic_sarah_badhabit_salvegiven","",""
"Scripts/Content/Story/Log_Entries/LOG_Constants_Notes.d:268","Наде определенно стало лучше. Жаль, что я не собралась проведать ее раньше.","Nadja zdecydowanie czuje się lepiej. Żałuję, że wcześniej jej nie odwiedziłam.","","False","topic_sarah_badhabit_successfriendly","",""
"Scripts/Content/Story/Log_Entries/LOG_Constants_Notes.d:269","Мы с Надей расстались на повышенных тонах. По крайней мере, она вылечилась. Может, когда ей станет легче, она это оценит.","Miałam z Nadją burzliwe rozstanie. Przynajmniej jest wyleczona. Może kiedy wyzdrowieje, wtedy to doceni.","","False","topic_sarah_badhabit_successangry","",""
"Scripts/Content/Story/Log_Entries/LOG_Constants_Notes.d:270","Саландрил может приготовить лекарство для курильщика, но ему нужны какие-то ингредиенты.","Salandril może przygotować lekarstwo dla osoby palącej, ale potrzebuje kilku składników.","","False","topic_sarah_badhabit_salandrilknowspotion","",""
"Scripts/Content/Story/Log_Entries/LOG_Constants_Notes.d:271","Нужны три стебля болотной травы, гриб драконьи слезы и красный лишайник. Болотная трава вырастает возле воды и в низинах, а красный лишайник можно найти на каменной кладке, причем только на высоте и в тени.","Potrzeba trzech łodyg bagiennego ziela, grzybów o nazwie Łzy smoka i Czerwony porost. Bagienne ziele rośnie w pobliżu wód i na nizinach, podczas gdy Czerwone porosty można znaleźć na kamiennych elementach, ale tylko na wzniesieniach i w miejscach zacienionych.","","False","topic_sarah_badhabit_salandrilingredients","",""
"Scripts/Content/Story/Log_Entries/LOG_Constants_Notes.d:272","За лекарство придется заплатить 1500 золотых.","Za lekarstwo będzie trzeba zapłacić 1500 sztuk złota.","","False","topic_sarah_badhabit_salandrilprice","",""
"Scripts/Content/Story/Log_Entries/LOG_Constants_Notes.d:273","Я отдала Саландрилу ингредиенты. Зелье скоро будет готово.","Salandril otrzymał składniki. Mikstura będzie wkrótce gotowa.","","False","topic_sarah_badhabit_salandrilproduction","",""
"Scripts/Content/Story/Log_Entries/LOG_Constants_Notes.d:274","Очищающее зелье у меня. Надо скорее отнести его Наде.","Mam miksturę oczyszczającą. Muszę jak najszybciej dostarczyć ją Nadji.","","False","topic_sarah_badhabit_gotpotion","",""
"Scripts/Content/Story/Log_Entries/LOG_Constants_Notes.d:275","За 100 золотых Саландрил продаст мне еще и мазь, которая укрепит легкие Нади. Но ей придется терпеть кашель ради лечения.","Za 100 sztuk złota Salandril sprzeda mi również maść, która wzmocni płuca Nadji. Ale będzie musiała znosić kaszel w trakcie kuracji.","","False","topic_sarah_badhabit_salandrilsalve","",""
"Scripts/Content/Story/Log_Entries/LOG_Constants_Notes.d:276","Мазь у меня. Скорее к Наде!","Mam tę maść. Pędem do Nadji!","","False","topic_sarah_badhabit_salandrilsalvegot","",""
"Scripts/Content/Story/Log_Entries/LOG_Constants_Notes.d:285","Охотник против орков","Myśliwy polujący na orków","","False","topic_grimbaldorcs","",""
"Scripts/Content/Story/Log_Entries/LOG_Constants_Notes.d:286","Спустившиеся с гор орки убили несколько охотников. Выжил только Гримбальд. Вероятно, несколько орков все еще там.","Orkowie przychodzący z gór zabili kilku myśliwych. Przeżył tylko Grimbald. Prawdopodobnie jest tam jeszcze kilku orków.","","False","topic_grimbaldorcs_start","",""
"Scripts/Content/Story/Log_Entries/LOG_Constants_Notes.d:287","Гримбальд не верит, что я могу победить орка. Вряд ли я его переубедить. Придется справляться своими силами.","Grimbald nie wierzy, że zdołam pokonać orka. Raczej nie zmienię jego zdania. Będę musiał zrobić to sam.","","False","topic_grimbaldorcs_unbealief","",""
"Scripts/Content/Story/Log_Entries/LOG_Constants_Notes.d:288","Гримбальд придумал способ забрать свой лук. Мне придется увести орков подальше от стоянки хотя бы на несколько минут. Нужно сказать Гримбальду, когда можно начинать.","Grimbald znalazł sposób na zdobycie łuku. Będę musiał odciągnąć orków od ich obozowiska na co najmniej kilka minut. Trzeba powiedzieć Grimbaldowi, kiedy można zaczynać.","","False","topic_grimbaldorcs_plan","",""
"Scripts/Content/Story/Log_Entries/LOG_Constants_Notes.d:289","Получилось! Гримбальд достал свой лук. За помощь он подарил мне шкуру мракориса и 100 золотых.","Udało się! Grimbald ma już swój łuk. Za pomoc dał mi skórę cieniostwora i 100 sztuk złota.","","False","topic_grimbaldorcs_success_bow","",""
"Scripts/Content/Story/Log_Entries/LOG_Constants_Notes.d:290","Гримбальд погиб. Ужасная трагедия.","Grimbald nie żyje. Ogromne nieszczęście.","","False","topic_grimbaldorcs_dead","",""
"Scripts/Content/Story/Log_Entries/LOG_Constants_Notes.d:291","Все орки мертвы. Нужно обрадовать Гримбальда.","Wszyscy orkowie nie żyją. Trzeba tą wiadomością ucieszyć Grimbalda.","","False","topic_grimbaldorcs_orcsdead","",""
"Scripts/Content/Story/Log_Entries/LOG_Constants_Notes.d:292","Гримбальд не поверил, что орки мертвы. Он решил сам убедиться в этом.","Grimbald nie uwierzył, że orkowie nie żyją. Postanowił przekonać się o tym na własne oczy.","","False","topic_grimbaldorcs_orcsdead_liar","",""
"Scripts/Content/Story/Log_Entries/LOG_Constants_Notes.d:293","Убедившись, что товарищи отомщены, Гримбальд ушел.","Po upewnieniu się, że jego towarzysze zostali pomszczeni, Grimbald odszedł.","","False","topic_grimbaldorcs_success_orcsdead","",""
"Scripts/Content/Story/Log_Entries/LOG_Constants_Notes.d:294","Гримбальд погиб. Да воссоединится его дух с душами погибших товарищей.","Grimbald nie żyje. Niech jego duch połączy się z duszami poległych towarzyszy.","","False","topic_grimbaldorcs_failed_grimbalddead","",""
"Scripts/Content/Story/Log_Entries/LOG_Constants_Notes.d:298","Почта Хориниса","Poczta w Khorinis","","False","topic_khorinispost","",""
"Scripts/Content/Story/Log_Entries/LOG_Constants_Notes.d:299","Вино попросил отнести письмо его друзьям в Восточный лес, в пещеру с железной решеткой. Для этого нужно идти по дороге через лес к горам, а от круга камней свернуть налево. Вход в пещеру спрятан под елями, не доходя до скал. Вино пообщеал, что за доставку меня щедро вознаградят.","Vino poprosił mnie, abym zaniósł list do jego przyjaciół we Wschodnim Lesie, do jaskini z żelazną kratą. Aby się tam dostać, należy podążać drogą przez las w kierunku gór i skręcić w lewo przy Kamiennym kręgu. Wejście do jaskini jest ukryte pod jodłami, tuż obok skał. Vino obiecał, że zostanę hojnie wynagrodzony za moje trudy.","","False","topic_khorinispost_vino","",""
"Scripts/Content/Story/Log_Entries/LOG_Constants_Notes.d:300","Я передал письмо друзьям Вино.","Przekazałem list przyjaciołom Vino.","","False","topic_khorinispost_bootleggerdelivered","",""
"Scripts/Content/Story/Log_Entries/LOG_Constants_Notes.d:301","Я передала письмо друзьям Вино.","Przekazałam list przyjaciołom Vino.","","False","topic_khorinispost_bootleggerdelivered_fem","",""
"Scripts/Content/Story/Log_Entries/LOG_Constants_Notes.d:302","Друзья Вино оказались совсем не дружелюбными. Они попытались убить меня, когда при мне не оказалось письма Вино. ","Przyjaciele Vino wcale nie byli przyjaźnie nastawieni. Próbowali mnie zabić, gdy nie było przy mnie listu od Vino.","","False","topic_khorinispost_bootleggerunfriendly","",""
"Scripts/Content/Story/Log_Entries/LOG_Constants_Notes.d:303","Похоже, награды за письмо мне не видать.","Chyba nie zobaczę nagrody za list.","","False","topic_khorinispost_bootleggernopay","",""
"Scripts/Content/Story/Log_Entries/LOG_Constants_Notes.d:304","“Друг“ Вино отказался платить за письмо и посоветовал обратиться к самому Вино. Что-то мне не хочется с ним спорить.","Niby przyjaciel Vino odmówił zapłacenia za list i poradził mi, aby osobiście skontaktować się z Vino. Nie mam ochoty spierać się z nim.","","False","topic_khorinispost_bootleggervinopay","",""
"Scripts/Content/Story/Log_Entries/LOG_Constants_Notes.d:305","За письмо мне не заплатили, зато подбросили еще работенки. Нужно отнести пакет с какими-то товарами Халвору из портового района.","Nie dostałem zapłaty za list, ale mam inne zadanie. Muszę zanieść paczkę z towarem do Halvora w dzielnicy portowej.","","False","topic_khorinispost_bootleggernewjob","",""
"Scripts/Content/Story/Log_Entries/LOG_Constants_Notes.d:306","Вино дал мне бутылку хорошего вина.","Vino dał mi butelkę dobrego wina.","","False","topic_khorinispost_vinowine","",""
"Scripts/Content/Story/Log_Entries/LOG_Constants_Notes.d:307","10 золотых - вся плата за доставку письма через пол-острова.","10 sztuk złota to cała opłata za dostarczenie listu przez pół wyspy.","","False","topic_khorinispost_vino10gold","",""
"Scripts/Content/Story/Log_Entries/LOG_Constants_Notes.d:308","Кажется, доставить письмо уже не получится... Лучше не буду говорить Вино об этом.","Chyba nie ma sposobu na dostarczenie listu... Lepiej nie mówić o tym Vino.","","False","topic_khorinispost_vinofailed","",""
"Scripts/Content/Story/Log_Entries/LOG_Constants_Notes.d:309","Вино отдал душу Белиару. Не видать мне награды.","Vino oddało moją duszę Beliarowi. Nie zostanę nagrodzony.","","False","topic_khorinispost_vinodead","",""
"Scripts/Content/Story/Log_Entries/LOG_Constants_Notes.d:310","Халвор получил свою посылку.","Halvor otrzymał swoją przesyłkę.","","False","topic_khorinispost_halvordelivered","",""
"Scripts/Content/Story/Log_Entries/LOG_Constants_Notes.d:311"," Он выглядел очень довольным, но не дал мне ни монеты."," Wyglądał na bardzo zadowolonego, ale nie dał mi ani sztuki złota.","","False","topic_khorinispost_halvorpayed0","",""
"Scripts/Content/Story/Log_Entries/LOG_Constants_Notes.d:312"," За доставку он заплатил 20 золотых. Почему у меня такое чувство, как будто меня надули?"," Wręczył mi 20 sztuk złota za dostawę. Dlaczego mam odczucie, że mnie oszukano?","","False","topic_khorinispost_halvorpayed20","",""
"Scripts/Content/Story/Log_Entries/LOG_Constants_Notes.d:313"," Он согласился заплатить 30 золотых за доставку. Какие-никакие, а все же деньги."," Zgodził się zapłacić 30 sztuk złota za dostawę. To niewiele złota, ale zawsze coś.","","False","topic_khorinispost_halvorpayed30","",""
"Scripts/Content/Story/Log_Entries/LOG_Constants_Notes.d:314","Халвору нужна пара часов, чтобы найти 100 золотых за доставку пакета.","Halvor potrzebuje kilku godzin, aby znaleźć 100 sztuk złota za dostarczenie paczki.","","False","topic_khorinispost_halvorwait","",""
"Scripts/Content/Story/Log_Entries/LOG_Constants_Notes.d:315","Да пусть подавится своим пакетом! Сразу бы сказал, что слишком дорого...","Niech się udławi swoją paczką! Mógł od razu powiedzieć, że jest za drogo...","","False","topic_khorinispost_halvor100give","",""
"Scripts/Content/Story/Log_Entries/LOG_Constants_Notes.d:316","Этот мерзавец обманул меня, да еще и дружка какого-то привел. Но мы еще посмотрим, кто кого!","Ten drań mnie oszukał i przyprowadził ze sobą jakiegoś kumpla. Ale zobaczymy, kto jeszcze kogo wykiwa!","","False","topic_khorinispost_halvor100fight","",""
"Scripts/Content/Story/Log_Entries/LOG_Constants_Notes.d:317","Вместо денег Халвор предложил еще какое-то дело. С меня хватит! Пусть сами носят свои письма и посылки.","Zamiast złota Halvor zaproponował inny interes. Mam dość! Niech sami noszą pisma i paczki.","","False","topic_khorinispost_halvornojob","",""
"Scripts/Content/Story/Log_Entries/LOG_Constants_Notes.d:318","Халвор тоже отказался платить. Вместо этого он предложил доставить еще 3 заказа. Мне нужно отдать торговцу Хакону с рыночной площади 3 куска руды за 150 золотых, Фернандо из Верхнего квартала кожу болотной акулы за 250 золотых и Валентино кольцо за 100 золотых. Моя доля - 50 золотых.","Halvor również odmówił zapłaty. Zamiast tego zaoferował dostarczenie trzech kolejnych zamówień. Kupcowi Hakonowi z placu targowego mam dać trzy bryłki rudy za 150 sztuk złota, Fernando z Górnej Dzielnicy skórę węża błotnego za 250 sztuk złota, a Valentino pierścień za 100 sztuk złota. Moja dola wynosi 50 sztuk złota.","","False","topic_khorinispost_halvorjob","",""
"Scripts/Content/Story/Log_Entries/LOG_Constants_Notes.d:319","Халвор получил свои деньги.","Halvor otrzymał swoje złoto.","","False","topic_khorinispost_halvorgive250","",""
"Scripts/Content/Story/Log_Entries/LOG_Constants_Notes.d:320","Все посылки доставлены. Пора отдать Халвору его 450 золотых.","Wszystkie przesyłki zostały dostarczone. Czas wręczyć Halvorowi jego 450 sztuk złota.","","False","topic_khorinispost_halvorall","",""
"Scripts/Content/Story/Log_Entries/LOG_Constants_Notes.d:321","Ой! Халвор умер. Не повезло.","O cholera! Halvor nie żyje. A to pech.","","False","topic_khorinispost_fail_halvordead","",""
"Scripts/Content/Story/Log_Entries/LOG_Constants_Notes.d:322","Хакон получил свою руду и заплатил ровно 150 золотых.","Hakon otrzymał swoją rudę i zapłacił dokładnie 150 sztuk złota.","","False","topic_khorinispost_hakondelivered","",""
"Scripts/Content/Story/Log_Entries/LOG_Constants_Notes.d:323","Хакон умер и за руду не заплатит. А золото Халвору отдавать все равно придется.","Hakon nie żyje i nie zapłaci za rudę. Ale Halvor i tak będzie żądał złota.","","False","topic_khorinispost_hakondead","",""
"Scripts/Content/Story/Log_Entries/LOG_Constants_Notes.d:324","Хакон попросил отнести руду кузнецу Гараду. За это он дал мне 10 золотых и велел отнести прямо сейчас.","Hakon poprosił mnie, abym zaniósł rudę do kowala Harada. Dał mi 10 sztuk złota i kazał natychmiast mu ją zanieść.","","False","topic_khorinispost_hakonpost","",""
"Scripts/Content/Story/Log_Entries/LOG_Constants_Notes.d:325","Руда у Гарада. Ему ее явно не хватает.","Harad otrzymał rudę. Wyraźnie mu jej brakuje.","","False","topic_khorinispost_haraddelivered","",""
"Scripts/Content/Story/Log_Entries/LOG_Constants_Notes.d:326","Хакона не устроила моя скорость доставки. Он потребовал вернуть руду и деньги.","Hakon nie był zadowolony z szybkości doręczenia przesyłki. Zażądał zwrotu rudy i złota.","","False","topic_khorinispost_haradback","",""
"Scripts/Content/Story/Log_Entries/LOG_Constants_Notes.d:327","Богач Валентино дал за свое кольцо лишних 50 монет.","Majętny Valentino dał dodatkowe 50 sztuk złota za swój pierścień.","","False","topic_khorinispost_valentinodelivered","",""
"Scripts/Content/Story/Log_Entries/LOG_Constants_Notes.d:328","Я вернул Валентино его 50 монет. Мне не нужны подачки!","Oddałem Valentino jego 50 sztuk złota. Nie potrzebuję jałmużny!","","False","topic_khorinispost_valentinomoneyback","",""
"Scripts/Content/Story/Log_Entries/LOG_Constants_Notes.d:329","Я вернула Валентино его 50 монет. Мне не нужны подачки!","Oddałam Valentino jego 50 sztuk złota. Nie potrzebuję jałmużny!","","False","topic_khorinispost_valentinomoneyback_fem","",""
"Scripts/Content/Story/Log_Entries/LOG_Constants_Notes.d:330","Богатенький Валентино протянул ноги, не успев заплатить за кольцо.","Bogacz Valentino wyzionął ducha, zanim zdążył zapłacić za pierścień.","","False","topic_khorinispost_valentinodead","",""
"Scripts/Content/Story/Log_Entries/LOG_Constants_Notes.d:331","Фернандо забрал кожу болотной акулы, но заплатил только 200 золотых.","Fernando wziął skórę węża błotnego, ale zapłacił tylko 200 sztuk złota.","","False","topic_khorinispost_fernandodelivered","",""
"Scripts/Content/Story/Log_Entries/LOG_Constants_Notes.d:332","Фернандо мертв. И кто теперь заплатит за кожу болотной акулы?","Fernando nie żyje. Kto teraz zapłaci za skórę węża błotnego?","","False","topic_khorinispost_fernandodead","",""
"Scripts/Content/Story/Log_Entries/LOG_Constants_Notes.d:333","Фернандо не стал отпираться и доплатил оставшиеся 50 золотых.","Fernando nie zaparł się i dopłacił pozostałe 50 sztuk złota.","","False","topic_khorinispost_fernandomoney","",""
"Scripts/Content/Story/Log_Entries/LOG_Constants_Notes.d:337","Пропавший работник","Zaginiony pracownik","","False","topic_lostbau","",""
"Scripts/Content/Story/Log_Entries/LOG_Constants_Notes.d:338","На ферме Лобарта пропал один из работников, Вино. Лобарт просил поискать его.","Na farmie Lobarta zaginął Vino, jeden z pracowników. Lobart poprosił mnie, żebym go odszukał.","","False","topic_lostbau_lobart","",""
"Scripts/Content/Story/Log_Entries/LOG_Constants_Notes.d:339","Вино нашелся. Стоит навестить его, когда он проспится.","Vino się odnalazł. Warto go odwiedzić, gdy wytrzeźwieje.","","False","topic_lostbau_found","",""
