"location","source","target","id","fuzzy","context","translator_comments","developer_comments"
"Scripts/Content/Story/Log_Entries/LOG_Constants_Notes.d:237","Бедняга Феллан совсем спятил и ушел из дому. Ирина, его жена, не знает, что и делать. Надо ей как-то помочь.","","","False","topic_sarah_oldfriends_fellan","",""
"Scripts/Content/Story/Log_Entries/LOG_Constants_Notes.d:238","Сумасбродный Феллан встретил свой конец. Бедная Ирина!","","","False","topic_sarah_oldfriends_fellandead","",""
"Scripts/Content/Story/Log_Entries/LOG_Constants_Notes.d:239","Ирина погибла. А она была такой молодой!","","","False","topic_sarah_oldfriends_irenedead","",""
"Scripts/Content/Story/Log_Entries/LOG_Constants_Notes.d:240","Дела у Ибрагима идут неважно, но он здоров.","","","False","topic_sarah_oldfriends_brahim","",""
"Scripts/Content/Story/Log_Entries/LOG_Constants_Notes.d:241","Ибрагима больше нет среди живых. Он был настоящим мастером пера и кисти.","","","False","topic_sarah_oldfriends_brahimdead","",""
"Scripts/Content/Story/Log_Entries/LOG_Constants_Notes.d:242","Старик Берни не пережил прошлую зиму... А я даже не знала. Надо бы помолиться за упокой его души.","","","False","topic_sarah_oldfriends_bernydead","",""
"Scripts/Content/Story/Log_Entries/LOG_Constants_Notes.d:243","Я помолилась Инносу за упокой души Берни. Светлый был старик!","","","False","topic_sarah_oldfriends_bernyprayinnos","",""
"Scripts/Content/Story/Log_Entries/LOG_Constants_Notes.d:244","Я помолилась Аданосу за упокой души Берни. Пусть море примет его!","","","False","topic_sarah_oldfriends_bernyprayadanos","",""
"Scripts/Content/Story/Log_Entries/LOG_Constants_Notes.d:245","Я помолилась Белиару, Богу Смерти, за упокой души Берни. Пусть будет он счастлив в загробном мире!","","","False","topic_sarah_oldfriends_bernypraybeliar","",""
"Scripts/Content/Story/Log_Entries/LOG_Constants_Notes.d:246","Я помолилась Белиару, Богу Смерти, за упокой души Берни. Он позволил мне попрощаться с его духом.","","","False","topic_sarah_oldfriends_bernypraybeliar2","",""
"Scripts/Content/Story/Log_Entries/LOG_Constants_Notes.d:247","Я встретилась со всеми своими старыми знакомыми. И на душе стало как-то легче.","","","False","topic_sarah_oldfriends_success","",""
"Scripts/Content/Story/Log_Entries/LOG_Constants_Notes.d:248","Никого из моих старых друзей больше нет в живых. Я как будто еще раз осиротела.","","","False","topic_sarah_oldfriends_failalldead","",""
"Scripts/Content/Story/Log_Entries/LOG_Constants_Notes.d:251","Вредная привычка","","","False","topic_sarah_badhabit","",""
"Scripts/Content/Story/Log_Entries/LOG_Constants_Notes.d:252","Оказывается, Надя подсела на болотник. Нужно срочно ее спасать, иначе она долго не протянет!","","","False","topic_sarah_badhabit_start","",""
"Scripts/Content/Story/Log_Entries/LOG_Constants_Notes.d:253","Надя не хочет меня слушать. В детстве мы дружили, но сейчас она на меня злится. Нужно посоветоваться с кем-нибудь. Кто у нас мастер наставлений?","","","False","topic_sarah_badhabit_nadjanotlisten","",""
"Scripts/Content/Story/Log_Entries/LOG_Constants_Notes.d:254","Мне нужно найти кого-то, кого она уважает. Родителей ее давно нет, да и не стала бы она их слушать. Эдда? В детстве она была нам как родная.","","","False","topic_sarah_badhabit_needauthority","",""
"Scripts/Content/Story/Log_Entries/LOG_Constants_Notes.d:255","Ватрас посоветовал поговорить с алхимиками насчет зелья, которое бы очистило тело Нади от отравы. Но одного зелья мало, нужно убедить ее бросить курить.","","","False","topic_sarah_badhabit_vatraspotion","",""
"Scripts/Content/Story/Log_Entries/LOG_Constants_Notes.d:256","Эдда сказала, что не может повлиять на Надю. О Аданос, ну почему эта девчонка такая твердолобая? С кем еще поговорить? Я готова пойти даже к Бромору, но его она тем более не послушает. Мо? Он вроде неплохой парень и достаточно пробивной. Или был таким.","","","False","topic_sarah_badhabit_eddanohelp","",""
"Scripts/Content/Story/Log_Entries/LOG_Constants_Notes.d:257","Мо пообещал поговорить с Надей, если я принесу ему белого рома. Это катастрофа, я не знаю ни одного торговца, у которого бы он был!","","","False","topic_sarah_badhabit_moewilltalk","",""
"Scripts/Content/Story/Log_Entries/LOG_Constants_Notes.d:258","Похоже, придется иметь дело не только с нелегальной торговлей болотником, но и с контрафактным алкоголем! В открытую, при свете дня, мне его точно никто не продаст.","","","False","topic_sarah_badhabit_bootleggers","",""
"Scripts/Content/Story/Log_Entries/LOG_Constants_Notes.d:259","Разговор с Мо ничего не дал. Только подтвердил упрямость Нади. Стоп. А если это использовать? Не уговорить, а разозлить. Она ненавидит гадюшник, в котором находится. Надо выяснить, кто ее особенно раздражает. Только потихоньку, чтобы Надя не догадалась, что это моя затея.","","","False","topic_sarah_badhabit_moefailed","",""
"Scripts/Content/Story/Log_Entries/LOG_Constants_Notes.d:260","Борка рассказал, что Надя и Люсия практически на ножах. Это то, что нужно! Надо подговорить Люсию поспорить с Надей, что она не сможет бросить курить - из-за своего упрямства Надя ни за что не проспорит.","","","False","topic_sarah_badhabit_knowlucia","",""
"Scripts/Content/Story/Log_Entries/LOG_Constants_Notes.d:261","Люсия согласилась на участие в моем плане. В награду она хочет ключ Бромора, который спрятан где-то в порту. Это большой стальной ключ с буквой Б на рукоятке. Думаю, поиски лучше начать в районе “Красного фонаря“.","","","False","topic_sarah_badhabit_askedlucia","",""
"Scripts/Content/Story/Log_Entries/LOG_Constants_Notes.d:262","Я отдала ключ Люсии. Она сегодня же поспорит с Надей. А я поговорю с ней завтра.","","","False","topic_sarah_badhabit_giveluciakey","",""
"Scripts/Content/Story/Log_Entries/LOG_Constants_Notes.d:263","Наконец-то сработало! Надя бросает курить. Похоже, это будет не так просто. Какое-нибудь очищающее зелье могло бы помочь.","","","False","topic_sarah_badhabit_itworked","",""
"Scripts/Content/Story/Log_Entries/LOG_Constants_Notes.d:264","Я отдала зелье Наде и наконец-то добилась от нее благодарности. Завтра надо будет ее проведать.","","","False","topic_sarah_badhabit_potiongotthanks","",""
"Scripts/Content/Story/Log_Entries/LOG_Constants_Notes.d:265","Надя вернула мне деньги за зелье. Это справедливо. Завтра надо будет ее проведать.","","","False","topic_sarah_badhabit_potiongotgold","",""
"Scripts/Content/Story/Log_Entries/LOG_Constants_Notes.d:266","Из-за лекарства Надя начала кашлять кровью. Нельзя же, чтобы вместо лечения оно загнало ее в могилу! Бегом к Саландрилу.","","","False","topic_sarah_badhabit_bloodycough","",""
"Scripts/Content/Story/Log_Entries/LOG_Constants_Notes.d:267","Я отдала мазь Наде. Теперь остается только ждать.","","","False","topic_sarah_badhabit_salvegiven","",""
"Scripts/Content/Story/Log_Entries/LOG_Constants_Notes.d:268","Наде определенно стало лучше. Жаль, что я не собралась проведать ее раньше.","","","False","topic_sarah_badhabit_successfriendly","",""
"Scripts/Content/Story/Log_Entries/LOG_Constants_Notes.d:269","Мы с Надей расстались на повышенных тонах. По крайней мере, она вылечилась. Может, когда ей станет легче, она это оценит.","","","False","topic_sarah_badhabit_successangry","",""
"Scripts/Content/Story/Log_Entries/LOG_Constants_Notes.d:270","Саландрил может приготовить лекарство для курильщика, но ему нужны какие-то ингредиенты.","","","False","topic_sarah_badhabit_salandrilknowspotion","",""
"Scripts/Content/Story/Log_Entries/LOG_Constants_Notes.d:271","Нужны три стебля болотной травы, гриб драконьи слезы и красный лишайник. Болотная трава вырастает возле воды и в низинах, а красный лишайник можно найти на каменной кладке, причем только на высоте и в тени.","","","False","topic_sarah_badhabit_salandrilingredients","",""
"Scripts/Content/Story/Log_Entries/LOG_Constants_Notes.d:272","За лекарство придется заплатить 1500 золотых.","","","False","topic_sarah_badhabit_salandrilprice","",""
"Scripts/Content/Story/Log_Entries/LOG_Constants_Notes.d:273","Я отдала Саландрилу ингредиенты. Зелье скоро будет готово.","","","False","topic_sarah_badhabit_salandrilproduction","",""
"Scripts/Content/Story/Log_Entries/LOG_Constants_Notes.d:274","Очищающее зелье у меня. Надо скорее отнести его Наде.","","","False","topic_sarah_badhabit_gotpotion","",""
"Scripts/Content/Story/Log_Entries/LOG_Constants_Notes.d:275","За 100 золотых Саландрил продаст мне еще и мазь, которая укрепит легкие Нади. Но ей придется терпеть кашель ради лечения.","","","False","topic_sarah_badhabit_salandrilsalve","",""
"Scripts/Content/Story/Log_Entries/LOG_Constants_Notes.d:276","Мазь у меня. Скорее к Наде!","","","False","topic_sarah_badhabit_salandrilsalvegot","",""
"Scripts/Content/Story/Log_Entries/LOG_Constants_Notes.d:285","Охотник против орков","","","False","topic_grimbaldorcs","",""
"Scripts/Content/Story/Log_Entries/LOG_Constants_Notes.d:286","Спустившиеся с гор орки убили несколько охотников. Выжил только Гримбальд. Вероятно, несколько орков все еще там.","","","False","topic_grimbaldorcs_start","",""
"Scripts/Content/Story/Log_Entries/LOG_Constants_Notes.d:287","Гримбальд не верит, что я могу победить орка. Вряд ли я его переубедить. Придется справляться своими силами.","","","False","topic_grimbaldorcs_unbealief","",""
"Scripts/Content/Story/Log_Entries/LOG_Constants_Notes.d:288","Гримбальд придумал способ забрать свой лук. Мне придется увести орков подальше от стоянки хотя бы на несколько минут. Нужно сказать Гримбальду, когда можно начинать.","","","False","topic_grimbaldorcs_plan","",""
"Scripts/Content/Story/Log_Entries/LOG_Constants_Notes.d:289","Получилось! Гримбальд достал свой лук. За помощь он подарил мне шкуру мракориса и 100 золотых.","","","False","topic_grimbaldorcs_success_bow","",""
"Scripts/Content/Story/Log_Entries/LOG_Constants_Notes.d:290","Гримбальд погиб. Ужасная трагедия.","","","False","topic_grimbaldorcs_dead","",""
"Scripts/Content/Story/Log_Entries/LOG_Constants_Notes.d:291","Все орки мертвы. Нужно обрадовать Гримбальда.","","","False","topic_grimbaldorcs_orcsdead","",""
"Scripts/Content/Story/Log_Entries/LOG_Constants_Notes.d:292","Гримбальд не поверил, что орки мертвы. Он решил сам убедиться в этом.","","","False","topic_grimbaldorcs_orcsdead_liar","",""
"Scripts/Content/Story/Log_Entries/LOG_Constants_Notes.d:293","Убедившись, что товарищи отомщены, Гримбальд ушел.","","","False","topic_grimbaldorcs_success_orcsdead","",""
"Scripts/Content/Story/Log_Entries/LOG_Constants_Notes.d:294","Гримбальд погиб. Да воссоединится его дух с душами погибших товарищей.","","","False","topic_grimbaldorcs_failed_grimbalddead","",""
"Scripts/Content/Story/Log_Entries/LOG_Constants_Notes.d:298","Почта Хориниса","","","False","topic_khorinispost","",""
"Scripts/Content/Story/Log_Entries/LOG_Constants_Notes.d:299","Вино попросил отнести письмо его друзьям в Восточный лес, в пещеру с железной решеткой. Для этого нужно идти по дороге через лес к горам, а от круга камней свернуть налево. Вход в пещеру спрятан под елями, не доходя до скал. Вино пообщеал, что за доставку меня щедро вознаградят.","","","False","topic_khorinispost_vino","",""
"Scripts/Content/Story/Log_Entries/LOG_Constants_Notes.d:300","Я передал письмо друзьям Вино.","","","False","topic_khorinispost_bootleggerdelivered","",""
"Scripts/Content/Story/Log_Entries/LOG_Constants_Notes.d:301","Я передала письмо друзьям Вино.","","","False","topic_khorinispost_bootleggerdelivered_fem","",""
"Scripts/Content/Story/Log_Entries/LOG_Constants_Notes.d:302","Друзья Вино оказались совсем не дружелюбными. Они попытались убить меня, когда при мне не оказалось письма Вино. ","","","False","topic_khorinispost_bootleggerunfriendly","",""
"Scripts/Content/Story/Log_Entries/LOG_Constants_Notes.d:303","Похоже, награды за письмо мне не видать.","","","False","topic_khorinispost_bootleggernopay","",""
"Scripts/Content/Story/Log_Entries/LOG_Constants_Notes.d:304","“Друг“ Вино отказался платить за письмо и посоветовал обратиться к самому Вино. Что-то мне не хочется с ним спорить.","","","False","topic_khorinispost_bootleggervinopay","",""
"Scripts/Content/Story/Log_Entries/LOG_Constants_Notes.d:305","За письмо мне не заплатили, зато подбросили еще работенки. Нужно отнести пакет с какими-то товарами Халвору из портового района.","","","False","topic_khorinispost_bootleggernewjob","",""
"Scripts/Content/Story/Log_Entries/LOG_Constants_Notes.d:306","Вино дал мне бутылку хорошего вина.","","","False","topic_khorinispost_vinowine","",""
"Scripts/Content/Story/Log_Entries/LOG_Constants_Notes.d:307","10 золотых - вся плата за доставку письма через пол-острова.","","","False","topic_khorinispost_vino10gold","",""
"Scripts/Content/Story/Log_Entries/LOG_Constants_Notes.d:308","Кажется, доставить письмо уже не получится... Лучше не буду говорить Вино об этом.","","","False","topic_khorinispost_vinofailed","",""
"Scripts/Content/Story/Log_Entries/LOG_Constants_Notes.d:309","Вино отдал душу Белиару. Не видать мне награды.","","","False","topic_khorinispost_vinodead","",""
"Scripts/Content/Story/Log_Entries/LOG_Constants_Notes.d:310","Халвор получил свою посылку.","","","False","topic_khorinispost_halvordelivered","",""
"Scripts/Content/Story/Log_Entries/LOG_Constants_Notes.d:311"," Он выглядел очень довольным, но не дал мне ни монеты.","","","False","topic_khorinispost_halvorpayed0","",""
"Scripts/Content/Story/Log_Entries/LOG_Constants_Notes.d:312"," За доставку он заплатил 20 золотых. Почему у меня такое чувство, как будто меня надули?","","","False","topic_khorinispost_halvorpayed20","",""
"Scripts/Content/Story/Log_Entries/LOG_Constants_Notes.d:313"," Он согласился заплатить 30 золотых за доставку. Какие-никакие, а все же деньги.","","","False","topic_khorinispost_halvorpayed30","",""
"Scripts/Content/Story/Log_Entries/LOG_Constants_Notes.d:314","Халвору нужна пара часов, чтобы найти 100 золотых за доставку пакета.","","","False","topic_khorinispost_halvorwait","",""
"Scripts/Content/Story/Log_Entries/LOG_Constants_Notes.d:315","Да пусть подавится своим пакетом! Сразу бы сказал, что слишком дорого...","","","False","topic_khorinispost_halvor100give","",""
"Scripts/Content/Story/Log_Entries/LOG_Constants_Notes.d:316","Этот мерзавец обманул меня, да еще и дружка какого-то привел. Но мы еще посмотрим, кто кого!","","","False","topic_khorinispost_halvor100fight","",""
"Scripts/Content/Story/Log_Entries/LOG_Constants_Notes.d:317","Вместо денег Халвор предложил еще какое-то дело. С меня хватит! Пусть сами носят свои письма и посылки.","","","False","topic_khorinispost_halvornojob","",""
"Scripts/Content/Story/Log_Entries/LOG_Constants_Notes.d:318","Халвор тоже отказался платить. Вместо этого он предложил доставить еще 3 заказа. Мне нужно отдать торговцу Хакону с рыночной площади 3 куска руды за 150 золотых, Фернандо из Верхнего квартала кожу болотной акулы за 250 золотых и Валентино кольцо за 100 золотых. Моя доля - 50 золотых.","","","False","topic_khorinispost_halvorjob","",""
"Scripts/Content/Story/Log_Entries/LOG_Constants_Notes.d:319","Халвор получил свои деньги.","","","False","topic_khorinispost_halvorgive250","",""
"Scripts/Content/Story/Log_Entries/LOG_Constants_Notes.d:320","Все посылки доставлены. Пора отдать Халвору его 450 золотых.","","","False","topic_khorinispost_halvorall","",""
"Scripts/Content/Story/Log_Entries/LOG_Constants_Notes.d:321","Ой! Халвор умер. Не повезло.","","","False","topic_khorinispost_fail_halvordead","",""
"Scripts/Content/Story/Log_Entries/LOG_Constants_Notes.d:322","Хакон получил свою руду и заплатил ровно 150 золотых.","","","False","topic_khorinispost_hakondelivered","",""
"Scripts/Content/Story/Log_Entries/LOG_Constants_Notes.d:323","Хакон умер и за руду не заплатит. А золото Халвору отдавать все равно придется.","","","False","topic_khorinispost_hakondead","",""
"Scripts/Content/Story/Log_Entries/LOG_Constants_Notes.d:324","Хакон попросил отнести руду кузнецу Гараду. За это он дал мне 10 золотых и велел отнести прямо сейчас.","","","False","topic_khorinispost_hakonpost","",""
"Scripts/Content/Story/Log_Entries/LOG_Constants_Notes.d:325","Руда у Гарада. Ему ее явно не хватает.","","","False","topic_khorinispost_haraddelivered","",""
"Scripts/Content/Story/Log_Entries/LOG_Constants_Notes.d:326","Хакона не устроила моя скорость доставки. Он потребовал вернуть руду и деньги.","","","False","topic_khorinispost_haradback","",""
"Scripts/Content/Story/Log_Entries/LOG_Constants_Notes.d:327","Богач Валентино дал за свое кольцо лишних 50 монет.","","","False","topic_khorinispost_valentinodelivered","",""
"Scripts/Content/Story/Log_Entries/LOG_Constants_Notes.d:328","Я вернул Валентино его 50 монет. Мне не нужны подачки!","","","False","topic_khorinispost_valentinomoneyback","",""
"Scripts/Content/Story/Log_Entries/LOG_Constants_Notes.d:329","Я вернула Валентино его 50 монет. Мне не нужны подачки!","","","False","topic_khorinispost_valentinomoneyback_fem","",""
"Scripts/Content/Story/Log_Entries/LOG_Constants_Notes.d:330","Богатенький Валентино протянул ноги, не успев заплатить за кольцо.","","","False","topic_khorinispost_valentinodead","",""
"Scripts/Content/Story/Log_Entries/LOG_Constants_Notes.d:331","Фернандо забрал кожу болотной акулы, но заплатил только 200 золотых.","","","False","topic_khorinispost_fernandodelivered","",""
"Scripts/Content/Story/Log_Entries/LOG_Constants_Notes.d:332","Фернандо мертв. И кто теперь заплатит за кожу болотной акулы?","","","False","topic_khorinispost_fernandodead","",""
"Scripts/Content/Story/Log_Entries/LOG_Constants_Notes.d:333","Фернандо не стал отпираться и доплатил оставшиеся 50 золотых.","","","False","topic_khorinispost_fernandomoney","",""
"Scripts/Content/Story/Log_Entries/LOG_Constants_Notes.d:337","Пропавший работник","","","False","topic_lostbau","",""
"Scripts/Content/Story/Log_Entries/LOG_Constants_Notes.d:338","На ферме Лобарта пропал один из работников, Вино. Лобарт просил поискать его.","","","False","topic_lostbau_lobart","",""
"Scripts/Content/Story/Log_Entries/LOG_Constants_Notes.d:339","Вино нашелся. Стоит навестить его, когда он проспится.","","","False","topic_lostbau_found","",""
"Scripts/Content/Story/Log_Entries/LOG_Constants_Notes.d:340","Мне встретился забавный крестьянин, Вино, пьяный в стельку. Стоит навестить его, когда он проспится. И поговорить с Лобартом - это, скорее всего, его работник.","","","False","topic_lostbau_found_1st","",""
"Scripts/Content/Story/Log_Entries/LOG_Constants_Notes.d:341","Лобарт чуть не придушил Вино, когда тот вернулся. То ли со злости, то ли от радости.","","","False","topic_lostbau_told","",""
"Scripts/Content/Story/Log_Entries/LOG_Constants_Notes.d:342","Вино пришел в себя настолько, что вспомнил про письмо для своих друзей. Думаю, с ним все будет в порядке.","","","False","topic_lostbau_letter","",""
"Scripts/Content/Story/Log_Entries/LOG_Constants_Notes.d:343","Вино погиб.","","","False","topic_lostbau_fail_deadvino","",""
"Scripts/Content/Story/Log_Entries/LOG_Constants_Notes.d:346","Голодные волки","","","False","topic_malethwolves","",""
"Scripts/Content/Story/Log_Entries/LOG_Constants_Notes.d:347","Стая волков постоянно задирает овец у пастуха Малета. Они приходят ночью, а днем где-то прячутся.","","","False","topic_malethwolves_start","",""
